,ticker,date,title
0,AAPL,2022-10-31T22:46:29+00:00,Top 12 ESG Companies in 2022
1,AAPL,2022-09-20T14:16:47+00:00,"Stocks: Tesla, Amazon dip ahead of Fed decision, Apple rises"
2,AAPL,2022-09-20T15:32:50+00:00,"S&amp;P 500 Off Lows, but Fed Hike Fears Keep Up Pressure"
3,AAPL,2022-09-20T16:08:08+00:00,Stock Market Today: Dow Slides as Focus Shifts to Hawkish Fed
4,AAPL,2022-09-20T16:28:53+00:00,"Apple iPhone camera shake issue may be ‘software fix,’ analyst says"
5,AAPL,2022-09-20T16:32:01+00:00,7 Nasdaq Stocks to Buy During a Stock Market Crash
6,AAPL,2022-09-20T17:00:05+00:00,Time to Buy Tech ETFs on the Dip?
7,AAPL,2022-09-20T17:00:31+00:00,"Windows 11 PC is getting a ton of updates, including live captions, gaming upgrades"
8,AAPL,2022-09-20T17:57:49+00:00,What is ESG? The latest front in the culture wars
9,AAPL,2022-09-20T18:42:00+00:00,Apple iPhone 14 Demand Is Strong. Will There Be Any Left for Christmas?
10,AAPL,2022-09-20T19:11:00+00:00,An Anti-ESG Activist Investor Presses for Changes at Apple and Disney
11,AAPL,2022-09-20T19:12:08+00:00,Ken Fisher’s Latest Portfolio: 10 Best Picks Under $30
12,AAPL,2022-09-20T19:58:17+00:00,Tesla and Apple lead Robinhood's investor index
13,AAPL,2022-09-20T20:16:26+00:00,"Dow Jones Falls Amid These Fed Meeting Fears; Apple Stock Climbs; Bitcoin Falls, Coinbase Slumps"
14,AAPL,2022-09-20T20:20:03+00:00,Amazon's growth under Andy Jassy allows for 'more engagement in M&amp;A': Analyst
15,AAPL,2022-09-20T20:47:54+00:00,"Dow Jones Futures: Big Fed Rate Hike On Tap, But Look For This; Tesla Flirts With Buy Points"
16,AAPL,2022-09-20T20:49:19+00:00,YouTube Takes On TikTok by Plugging Advertising Into Shorts Videos
17,AAPL,2022-09-20T21:02:53+00:00,"Apple, Google Buybacks Top U.S. Companies As Repurchases Fall Nearly 22%"
18,AAPL,2022-09-20T21:27:00+00:00,‘Serial’ Rises on Podcast Charts After Adnan Syed Conviction Is Vacated
19,AAPL,2022-09-20T21:31:03+00:00,Why Investors Found Apple Stock Tempting Today
20,AAPL,2022-09-20T21:45:09+00:00,Apple (AAPL) Gains As Market Dips: What You Should Know
21,AAPL,2022-09-20T23:59:54+00:00,"Dow Jones Futures: Fed Rate Hike On Tap, But This Is What Matters; Tesla Flirts With Buy Points"
22,AAPL,2022-09-21T00:51:54+00:00,"Dow Jones Futures Await Fed Rate Hike, But This Is What Matters; Tesla Flirts With Buy Points"
23,AAPL,2022-09-21T09:06:00+00:00,Warren Buffett Is Sitting On $168 Billion In Unrealized Gains From These 4 Stocks
24,AAPL,2022-09-21T09:12:00+00:00,"If Predictions of a Flat Stock Market Come True, I Still Think This Stock Can Win"
25,AAPL,2022-09-21T10:00:05+00:00,7 Tech Stocks to Buy Now for Extraordinary Gains
26,AAPL,2022-09-21T10:41:43+00:00,Apple may move a quarter of iPhone production to India by 2025 -JPM
27,AAPL,2022-09-21T11:07:00+00:00,2 Top Buffett Stocks To Buy and Hold for the Long Haul
28,AAPL,2022-09-21T11:36:00+00:00,"Fed Day, Energy Commodity Prices, Dangerous Russia, Charting the S&amp;P, Apple"
29,AAPL,2022-09-21T12:03:54+00:00,"Dow Jones Futures Rise: Fed Rate Hike Looms, But This Is What Matters; Tesla Flirts With Buy Points"
30,AAPL,2022-09-21T13:00:00+00:00,"Apple Watch Ultra Review: Better Battery Life, but Not Quite Extreme"
31,AAPL,2022-09-21T13:06:49+00:00,10 Tech Stocks to Avoid As Inflation Heats Up
32,AAPL,2022-09-21T13:11:14+00:00,10 Chinese Stocks to Avoid Amid Economic Slowdown
33,AAPL,2022-09-21T13:37:34+00:00,"Hacking, Fake Volume And Market Manipulation – The Issues In Crypto Trading And How One Company Is Helping Combat Them"
34,AAPL,2022-09-21T14:53:00+00:00,Where Will Apple Be in 5 Years?
35,AAPL,2022-09-21T15:27:25+00:00,"Apple iPhone 14 Getting Lift From Carrier Promotions, Advertising"
36,AAPL,2022-09-21T15:59:34+00:00,Stock Market Today: Dow in Wild Ride to End Lower After Fed Hikes Rates
37,AAPL,2022-09-21T18:59:09+00:00,10 Dow Jones Stocks to Buy According to Hedge Funds
38,AAPL,2022-09-21T19:05:42+00:00,15 Best Stocks To Invest In Right Now
39,AAPL,2022-09-21T22:00:49+00:00,Apple to use TSMC’s next 3-nm chip tech in iPhones and Macs next year
40,AAPL,2022-09-22T01:17:43+00:00,Meta Sued for Skirting Apple Privacy Rules to Snoop on Users
41,AAPL,2022-09-22T09:05:00+00:00,Should Apple Make Its Own Search Engine and Cut Google Out of the Mix?
42,AAPL,2022-09-22T09:15:00+00:00,3 Cheap Dow Jones Stocks to Buy Right Now
43,AAPL,2022-09-22T10:00:18+00:00,7 Dow Stocks to Buy on the Dip or You’ll Be Kicking Yourself Later
44,AAPL,2022-09-22T11:15:11+00:00,7 Meme Stocks to Buy During a Stock Market Crash
45,AAPL,2022-09-22T11:21:00+00:00,"If I Could Buy Just 1 Stock Right Now, Apple Would Be It. Here's Why."
46,AAPL,2022-09-22T11:42:00+00:00,This Digital Ad Software Tech Stock Is Beating the Nasdaq Index -- Is It a Buy?
47,AAPL,2022-09-22T12:04:13+00:00,"More Antitrust Pain For Amazon, Microsoft And Google: UK Regulator Promises Action"
48,AAPL,2022-09-22T13:00:00+00:00,Apple AirPods Pro Second-Gen Review: Impressive All-Around
49,AAPL,2022-09-22T13:00:00+00:00,3 Beaten-Down Nasdaq Stocks You'll Regret Not Buying the Dip On
50,AAPL,2022-09-22T13:00:19+00:00,"Apple AirPods Pro add better sound, improved controls to Apple’s best earbuds"
51,AAPL,2022-09-22T13:10:00+00:00,"2 Cheap Dow Jones Stocks to Buy Hand Over Fist, and 1 to Avoid"
52,AAPL,2022-09-22T13:21:15+00:00,10 Stocks to Buy According to Bulldog Investors
53,AAPL,2022-09-22T13:45:22+00:00,"Investors Find a Lot to Like in Tech, Even as a Market Bottom Remains Elusive"
54,AAPL,2022-09-22T13:46:00+00:00,"AirPods Pro 2nd-Gen Review: Better Noise Canceling, Easier to Find When Lost"
55,AAPL,2022-09-22T14:00:00+00:00,2 Monster Stocks to Buy Without Any Hesitation
56,AAPL,2022-09-22T14:15:00+00:00,Should You Really Buy Apple Stock?
57,AAPL,2022-09-22T14:45:00+00:00,My 3 Favorite Stocks Right Now
58,AAPL,2022-09-22T15:05:34+00:00,Stock Market Slump: Should You Really Buy Roku Stock?
59,AAPL,2022-09-22T16:14:18+00:00,"Apple AirPods Pro review: Improved sound, controls make for Apple’s best ear buds yet"
60,AAPL,2022-09-22T16:24:57+00:00,"“That Which Drops the Most, Bounces the Most”: Ken Fisher’s Top 10 Growth Stock Picks"
61,AAPL,2022-09-22T16:29:23+00:00,US senators increase pressure on Apple over possible Chinese chipmaker deal
62,AAPL,2022-09-22T16:37:52+00:00,3 Dow Stocks to Buy During a Stock Market Crash
63,AAPL,2022-09-22T17:15:00+00:00,Inflation Isn't Caused By Some Greedy Ebenezer Scrooge-Like Character
64,AAPL,2022-09-22T17:51:02+00:00,7 S&amp;P 500 Stocks to Buy During a Stock Market Crash
65,AAPL,2022-09-22T18:32:54+00:00,10 Most Searched Stocks on Insider Monkey
66,AAPL,2022-09-22T19:06:00+00:00,Senators Raise Concerns Over Apple’s Potential Deal With Chinese Chip Maker
67,AAPL,2022-09-22T19:54:08+00:00,These 10 Stocks are Plummeting After the Fed’s Latest Rate Hike
68,AAPL,2022-09-22T20:27:31+00:00,Apple Fixes iPhone 14 Pro Camera-Shake and Copy-and-Paste Bugs
69,AAPL,2022-09-22T20:40:08+00:00,Alphabet (GOOGL) Embeds Google Tasks With Assistant to Ease Job
70,AAPL,2022-09-23T04:46:46+00:00,UPDATE 2-Apple will sponsor Super Bowl halftime show starting in February
71,AAPL,2022-09-23T05:37:41+00:00,Apple Music Takes Over Pepsi as Presenter of Super Bowl Halftime Show
72,AAPL,2022-09-23T08:02:59+00:00,"Costco, FedEx, Boeing Fall Premarket; Raytheon, FuboTV Rise"
73,AAPL,2022-09-23T09:11:00+00:00,"Stocks Extend Slide, Costco, DocuSign, Boeing And Apple In Focus - Five Things To Know"
74,AAPL,2022-09-23T09:30:00+00:00,Will Microsoft Be Worth More Than Apple by 2025?
75,AAPL,2022-09-23T10:27:52+00:00,U.S. Stocks Tumble on Fear of Global Economic Slowdown
76,AAPL,2022-09-23T11:38:24+00:00,"Apple Resolves iPhone 14 Pro Camera Glitch, As Promised"
77,AAPL,2022-09-23T12:18:28+00:00,Dow Jones Futures Sell Off Ahead Of Powell Comments As Recession Fears Mount
78,AAPL,2022-09-23T13:00:26+00:00,Does Apple (NASDAQ:AAPL) Deserve A Spot On Your Watchlist?
79,AAPL,2022-09-23T13:03:11+00:00,“Still Optimistic”: 10 American Manufacturing Stocks to Buy Now
80,AAPL,2022-09-23T13:14:00+00:00,Apple: A Worst Case Technical Story
81,AAPL,2022-09-23T13:36:30+00:00,10 Best Blue Chip Stocks to Buy According to Phill Gross and Robert Atchinson’s Adage Capital
82,AAPL,2022-09-23T13:58:28+00:00,Dow Jones Sells Off Ahead Of Powell Comments As Recession Fears Mount
83,AAPL,2022-09-23T14:10:08+00:00,Dow Plunges into Bear Market  as Recession Fears Rattle Investors
84,AAPL,2022-09-23T14:48:35+00:00,Apple replaces Pepsi as NFL Super Bowl Halftime sponsor
85,AAPL,2022-09-23T14:54:16+00:00,7 Growth Stocks to Buy During a Stock Market Crash
86,AAPL,2022-09-23T15:10:00+00:00,Apple Music to Replace Pepsi as Sponsor of NFL’s Super Bowl Halftime Show
87,AAPL,2022-09-23T15:54:43+00:00,"Apple iPhone 14 ‘targeting those who upgraded 3, 4, 5 years ago,’ IDC VP says"
88,AAPL,2022-09-23T16:05:02+00:00,NFL selects Apple Music as Super Bowl halftime sponsor
89,AAPL,2022-09-23T16:09:59+00:00,Stock Market Today: Dow Bears Sharpen Claws as Recession Fever Spikes
90,AAPL,2022-09-23T16:39:22+00:00,Why Apple Stock Slumped Friday Morning -- but Shouldn't Have
91,AAPL,2022-09-23T17:37:33+00:00,10 Best ETFs to Diversify Your Portfolio and Avoid Risks
92,AAPL,2022-09-23T17:39:57+00:00,Why Meta Platforms Stock Fell Early on Friday
93,AAPL,2022-09-23T18:25:08+00:00,7 Investments to FIRE Up a Fat Stash and Retire Early
94,AAPL,2022-09-23T18:49:01+00:00,Meta is desperate to fight back against Apple’s privacy changes
95,AAPL,2022-09-23T19:14:21+00:00,Apple Music Super Bowl Halftime Show 'another sign that Cupertino will be aggressive' in sports: Wedbush's Ives
96,AAPL,2022-09-23T19:27:50+00:00,Tech stocks search for direction amid tech sell-off volatility
97,AAPL,2022-09-23T19:54:00+00:00,Aaron Judge Could Make History Friday Night but It Won’t Be on Broadcast TV
98,AAPL,2022-09-23T20:00:39+00:00,Apple set to break average iPhone price record twice in coming months
99,AAPL,2022-09-23T20:25:51+00:00,Record Bearish Bets Hit Bilibili Even After 90% Dive
100,AAPL,2022-09-23T20:59:00+00:00,Apple Music replaces Pepsi as new sponsor of Super Bowl halftime show
101,AAPL,2022-09-23T21:01:32+00:00,"Dow Jones Futures: Bear Market Eyes New Leg Down; Apple, Eli Lilly Show Relative Strength"
102,AAPL,2022-09-23T21:08:39+00:00,Apple TV+ set to exclusively host historic Yankees game
103,AAPL,2022-09-23T22:37:00+00:00,Weekly Roundup
104,AAPL,2022-09-25T11:38:00+00:00,"With Apple Threatening, Is It Time to Sell Garmin?"
105,AAPL,2022-09-25T13:09:00+00:00,Better Software Stock: Adobe vs. Unity
106,AAPL,2022-09-25T14:15:00+00:00,Why Is Everyone Talking About Apple?
107,AAPL,2022-09-25T20:56:00+00:00,Rihanna to Headline the NFL’s Super Bowl Halftime Show
108,AAPL,2022-09-25T22:06:32+00:00,"Dow Jones Futures Fall: Bear Market Eyes New Leg Down; Apple, Eli Lilly Show Relative Strength"
109,AAPL,2022-09-26T00:09:32+00:00,"Dow Jones Futures Fall, Yields Rise As Bear Market Eyes New Leg Down"
110,AAPL,2022-09-26T00:47:32+00:00,"Dow Jones Futures Fall, Bond Yields Rise As Bear Market Eyes New Leg Down"
111,AAPL,2022-09-26T01:19:32+00:00,"Dow Jones Futures Fall As Yields Rise, Pound Dives To Record Low; Bear Market Eyes New Leg Down"
112,AAPL,2022-09-26T04:55:54+00:00,Apple says it will manufacture iPhone 14 in India
113,AAPL,2022-09-26T05:16:38+00:00,Tech Stocks Face Another 10% Drop or More as Strong Dollar Hits Profits
114,AAPL,2022-09-26T05:31:37+00:00,UPDATE 1-Apple says it will manufacture iPhone 14 in India
115,AAPL,2022-09-26T06:05:26+00:00,"New iPhone’s Initial China Sales Lag Predecessor, Jefferies Says"
116,AAPL,2022-09-26T07:46:27+00:00,Exclusive-India's push for home-grown navigation system jolts smartphone giants
117,AAPL,2022-09-26T07:48:35+00:00,Apple Begins Making iPhone 14 in India Weeks Ahead of Schedule
118,AAPL,2022-09-26T07:50:30+00:00,"PG&amp;E, Las Vegas Sands, Planet Fitness Rise Premarket; Li Auto, Lyft Fall"
119,AAPL,2022-09-26T09:10:00+00:00,Stock Market Sell-Off: 2 Safe Tech Stocks to Buy Now and Hold Forever
120,AAPL,2022-09-26T10:00:00+00:00,3 Bargain Stocks You Can Buy Today and Hold Forever
121,AAPL,2022-09-26T10:35:37+00:00,U.S. Stocks Rise as Tech Lifts All Boats
122,AAPL,2022-09-26T10:47:00+00:00,Are Any of the FAANG Stocks Worth Buying?
123,AAPL,2022-09-26T11:18:58+00:00,Apple expands iPhone production in India in shift away from China
124,AAPL,2022-09-26T12:24:01+00:00,Dow Jones Futures Continue To Fall As Stock Market Correction Worsens; Treasury Yields Surge
125,AAPL,2022-09-26T13:11:05+00:00,10 Most Shorted Stocks in 2022
126,AAPL,2022-09-26T13:14:46+00:00,10 Stock Picks to Beat the Market Slump
127,AAPL,2022-09-26T13:20:00+00:00,Apple to make iPhone 14 in India
128,AAPL,2022-09-26T13:20:01+00:00,Key Factors to Note Ahead of TD SYNNEX's (SNX) Q3 Earnings
129,AAPL,2022-09-26T13:28:01+00:00,Factors to Note Ahead of Micron Technology's (MU) Q4 Earnings
130,AAPL,2022-09-26T13:30:00+00:00,2 Growth Stocks Down 14% to 28% to Buy and Hold Forever
131,AAPL,2022-09-26T13:37:00+00:00,Why I'm More Excited Than Ever About Disney Stock
132,AAPL,2022-09-26T13:38:01+00:00,Dow Jones Continues To Fall As Stock Market Correction Worsens; Treasury Yields Surge
133,AAPL,2022-09-26T13:39:02+00:00,Tesla's Stock Emerges as Unlikely Megacap Rival to Apple
134,AAPL,2022-09-26T13:49:38+00:00,The 3 Most Undervalued Quantum Computing Stocks to Buy Now
135,AAPL,2022-09-26T14:39:09+00:00,S&amp;P 500 in U-Turn as Rising Treasury Yields Bite
136,AAPL,2022-09-26T15:52:03+00:00,Apple (AAPL) Starts Producing iPhone 14 in India Ahead of Time
137,AAPL,2022-09-26T16:57:46+00:00,Why Apple Stock Rallied Monday Morning
138,AAPL,2022-09-26T16:59:00+00:00,"Apple’s iPhone 14 sales come up short in China, report says"
139,AAPL,2022-09-26T17:31:17+00:00,Stock market: Here's one veteran strategist's guess at a bear market bottom
140,AAPL,2022-09-26T18:27:28+00:00,10 Quality Stocks to Buy with Shares Down Over 30% YTD
141,AAPL,2022-09-26T18:41:00+00:00,"Author Morgan Housel Talks About Inflation, Buffett, Bear Markets, and More"
142,AAPL,2022-09-26T18:47:37+00:00,TikTok Deal Remains Elusive as Biden Administration Works to Solve Data Concerns
143,AAPL,2022-09-26T18:53:06+00:00,Alphabet (GOOGL) to Boost YouTube Music With New Capabilities
144,AAPL,2022-09-26T18:56:14+00:00,Apple iPhone 14 demand trending ‘ahead of iPhone 13’: Wedbush’s Dan Ives
145,AAPL,2022-09-26T19:42:00+00:00,"iPhone 14 Demand in China Weaker Than Expected, Jefferies Says"
146,AAPL,2022-09-26T19:54:00+00:00,Netflix Doing More of What Netflix Members Don't Want
147,AAPL,2022-09-26T20:10:17+00:00,Apple iPhone 14 Pro Models Could Give Company A Profit Boost
148,AAPL,2022-09-26T21:45:09+00:00,Apple (AAPL) Gains As Market Dips: What You Should Know
149,AAPL,2022-09-26T23:48:00+00:00,Netflix Makes an Apple and Amazon Mistake it Can't Afford to Copy
150,AAPL,2022-09-27T02:01:00+00:00,Tim Cook and Apple Make a Move That Could Annoy China
151,AAPL,2022-09-27T04:00:00+00:00,Europe Considers Making Big Tech Pay for Building the Internet
152,AAPL,2022-09-27T09:10:00+00:00,2 Beaten-Down Value Stocks That Could Crush the Market
153,AAPL,2022-09-27T09:45:00+00:00,Don't Worry About Stock-Picking Accuracy When You're Swinging for a Home Run
154,AAPL,2022-09-27T10:05:00+00:00,1 Move That Could Supercharge Apple's iPhone Revenue
155,AAPL,2022-09-27T11:33:00+00:00,Apple Turns to the Pros
156,AAPL,2022-09-27T11:38:21+00:00,Ford Pitches For Fresh Trial After $1.7B Jury Verdict In Truck Rollover Mishap
157,AAPL,2022-09-27T13:15:50+00:00,10 Stocks to Sell Now According to Javier Velazquez’s Albar Capital
158,AAPL,2022-09-27T13:56:01+00:00,Alphabet (GOOGL) Boosts Google Photos With Recent Upgrades
159,AAPL,2022-09-27T14:01:04+00:00,Should You Investigate Apple Inc. (NASDAQ:AAPL) At US$151?
160,AAPL,2022-09-27T14:48:11+00:00,S&amp;P 500 Stumbles as Tech Struggles to Hold Gains
161,AAPL,2022-09-27T15:47:29+00:00,2 Beaten-Down Stocks to Buy Before the Next Bull Market Begins
162,AAPL,2022-09-27T16:30:24+00:00,Why Apple Stock Was Up Earlier This Morning
163,AAPL,2022-09-27T16:44:07+00:00,Stock Market Today: Dow Ends Wild Ride in Red as Bears Strengthen Grip
164,AAPL,2022-09-27T19:08:00+00:00,Apple’s Wearables Are Like the iPhone. The Costlier Models Are Selling Better.
165,AAPL,2022-09-27T19:57:22+00:00,10 Most Shorted Stocks in the World
166,AAPL,2022-09-28T01:19:18+00:00,Apple Ditches iPhone Production Increase After Demand Falters
167,AAPL,2022-09-28T01:39:24+00:00,Apple drops plan to boost iPhone production as demand falters-Bloomberg
168,AAPL,2022-09-28T02:16:02+00:00,Fast Company's website shuts after Apple News feed hacked
169,AAPL,2022-09-28T02:54:30+00:00,UPDATE 1-Apple drops plan to boost iPhone production as demand falters-Bloomberg
170,AAPL,2022-09-28T03:45:50+00:00,"Dow Jones Futures Fall On Apple iPhone Report, Rising Treasury Yields; Biogen Alzheimer's Drug Slows Decline"
171,AAPL,2022-09-28T05:37:46+00:00,Apple Suppliers Drop as Firm Said to Ditch IPhone Output Boost
172,AAPL,2022-09-28T05:37:46+00:00,Apple Suppliers Drop as Firm Said to Ditch IPhone Output Boost
173,AAPL,2022-09-28T06:48:29+00:00,"Bond Rout Lifts Dollar, Apple Output Plans, Gas Sabotage- What's Moving Markets"
174,AAPL,2022-09-28T06:59:38+00:00,"Dow Futures Largely Flat; Fed Speakers, Apple Sales in Focus"
175,AAPL,2022-09-28T08:02:33+00:00,"Apple, Qualcomm, Lyft Fall Premarket; Biogen, Netflix Rise"
176,AAPL,2022-09-28T09:00:00+00:00,Last Chance for Antitrust Bill to Curb Big Tech Now Hangs on Lame Duck Vote
177,AAPL,2022-09-28T10:00:08+00:00,7 Blue-Chip Sleeper Stocks to Buy Before Wall Street Wakes Up
178,AAPL,2022-09-28T10:04:00+00:00,"Stocks Resume Slump, Apple, Biogen, Elon Musk And Hurricane Ian - Five Things To Know"
179,AAPL,2022-09-28T10:12:00+00:00,1 Big Reason Qualcomm No Longer Fears Losing Its Largest Customer
180,AAPL,2022-09-28T10:15:13+00:00,7 Large-Cap Stocks With Sustained Dividend Growth Potential
181,AAPL,2022-09-28T10:37:39+00:00,U.S. Stocks Rise as Bond Yields Ease
182,AAPL,2022-09-28T10:45:38+00:00,7 Growth Stocks to Buy Before the Bull Market Returns
183,AAPL,2022-09-28T10:57:24+00:00,WhatsApp Boss Highlights Global Repercussions Of UK Online Safety Bill
184,AAPL,2022-09-28T11:04:50+00:00,"Dow Jones Futures Cut Losses On Bank Of England Reversal; Apple Falls On iPhone Report, Biogen Soars On Alzheimer's Drug"
185,AAPL,2022-09-28T11:08:00+00:00,Apple Stock Slides On Report of iPhone Production U-Turn Amid Waning Consumer Demand
186,AAPL,2022-09-28T11:17:50+00:00,"Dow Jones Futures Volatile On Bank Of England Reversal; Apple Falls On iPhone Report, Biogen Soars On Alzheimer's Drug"
187,AAPL,2022-09-28T11:33:00+00:00,"Apple Heartbreak, Bond Breakout, They Asked Evans, Trading Tesla, Going Nuclear"
188,AAPL,2022-09-28T11:43:00+00:00,GM Defers Return-To-Office Mandate Following Employee Pressure
189,AAPL,2022-09-28T12:14:10+00:00,Stock market today: 4 tickers trending on Yahoo Finance
190,AAPL,2022-09-28T13:10:53+00:00,10 Companies that are Buying Back Their Stock in 2022
191,AAPL,2022-09-28T13:35:21+00:00,Dow Jones Rises Ahead Of Powell Speech; 10-Year Treasury Yield Briefly Tops 4%
192,AAPL,2022-09-28T13:40:58+00:00,11 Best Cryptocurrency Stocks to Buy According to Hedge Funds
193,AAPL,2022-09-28T13:43:40+00:00,Micron Earnings Are Key as Apple News Points to Slowdown
194,AAPL,2022-09-28T13:49:36+00:00,"Midday Movers: Biogen, Apple, DocuSign and More"
195,AAPL,2022-09-28T14:07:50+00:00,"Pay boosts for Oracle's Ellison, Katz move their rewards past Apple's Tim Cook"
196,AAPL,2022-09-28T14:51:44+00:00,Block Introduces 'Tap To Pay' On Apple iPhone For Hasslefree Contactless Commerce
197,AAPL,2022-09-28T15:12:31+00:00,S&amp;P 500 Rides Slump in U.S. Treasury Yields Higher
198,AAPL,2022-09-28T16:03:44+00:00,What Apple’s production pullback says about iPhone 14 demand
199,AAPL,2022-09-28T16:06:08+00:00,Stock Market Today: Dow Racks Up Gains Amid Plunging Treasury Yields
200,AAPL,2022-09-28T16:27:03+00:00,CMA’s Hayter Says UK’s Tech Law Enforcement Is ‘Out of Date’
201,AAPL,2022-09-28T16:28:10+00:00,Why Apple Stock Is Falling Today
202,AAPL,2022-09-28T16:51:23+00:00,US STOCKS-Wall Street jumps over 1% in choppy trading as yields dip
203,AAPL,2022-09-28T17:21:00+00:00,IPhone Report Sends Apple Below Key Support. Check the Chart.
204,AAPL,2022-09-28T17:36:44+00:00,Tech’s ugly quarter will bleed into October
205,AAPL,2022-09-28T18:04:07+00:00,Apple Ditches iPhone Production Boost
206,AAPL,2022-09-28T18:29:18+00:00,US STOCKS-Wall Street bounces back as Treasury yields dip
207,AAPL,2022-09-28T19:23:00+00:00,"Dow Jones Jumps As Yields Plunge; This New Cathie Wood Buy Rockets; Bitcoin Rallies, Coinbase Jumps"
208,AAPL,2022-09-28T20:00:36+00:00,US STOCKS-Wall Street ends sharply higher as Treasury yields dip
209,AAPL,2022-09-28T20:16:48+00:00,"Apple Turns Cautious On iPhone Orders, Rattling Component Suppliers"
210,AAPL,2022-09-28T20:20:50+00:00,US STOCKS-Wall Street ends sharply higher as Treasury yields dip
211,AAPL,2022-09-28T21:00:17+00:00,7 Undervalued Reddit Stocks to Buy Before Wall Street Catches On
212,AAPL,2022-09-28T21:21:20+00:00,Apple's falling iPhone demand isn't as bad as it sounds
213,AAPL,2022-09-28T21:28:24+00:00,"Dow Jones Jumps 549 Points As Treasury Yields Tumble, But Now What? Eli Lilly Leads 7 Bullish Stocks"
214,AAPL,2022-09-28T21:53:00+00:00,Intel Not Ready to Cash in Its Chips with Apple
215,AAPL,2022-09-28T22:02:33+00:00,Apple: production deconstruction is less worrying than strong dollar
216,AAPL,2022-09-28T22:54:10+00:00,What's Going On With Apple?
217,AAPL,2022-09-29T03:20:59+00:00,"India Eyes $550 Million Incentives to Draw Apple, Tablet Makers"
218,AAPL,2022-09-29T07:48:59+00:00,"Apple, Amazon, American Airlines Fall Premarket; Bed Bath &amp; Beyond Rises"
219,AAPL,2022-09-29T09:07:00+00:00,Nasdaq Sell-Off: 2 Warren Buffett Stocks He Plans to Hold Forever
220,AAPL,2022-09-29T09:15:00+00:00,3 Beaten-Down Dow Stocks to Buy Before the Market Bounces Back
221,AAPL,2022-09-29T10:00:00+00:00,Why Apple and TSMC Stocks Were Down on Wednesday
222,AAPL,2022-09-29T10:34:46+00:00,"Stocks bear market 'will continue into the first quarter,' portfolio manager says"
223,AAPL,2022-09-29T10:42:40+00:00,"India Weighs Plum Incentives To Lure Apple, Dell, HP As China's COVID-19 Lockdowns Weigh"
224,AAPL,2022-09-29T10:43:00+00:00,Things Are Starting to Break. But the Fed and BoE Aren’t Done Hiking.
225,AAPL,2022-09-29T10:49:24+00:00,Dow Jones Futures Fall As Treasury Yields Rebound; Eli Lilly Leads 7 Bullish Stocks
226,AAPL,2022-09-29T13:10:00+00:00,Nasdaq Bear Market: 2 Unbelievable Stocks You'll Regret Not Buying on the Dip
227,AAPL,2022-09-29T13:13:35+00:00,"Midday Movers: CarMax, Peloton, Rite Aid and More"
228,AAPL,2022-09-29T14:06:13+00:00,Dow Jones Plunges After Key Economic Data; Apple Dives On Downgrade
229,AAPL,2022-09-29T14:07:00+00:00,Why I'm Avoiding Peloton Stock Like the Plague
230,AAPL,2022-09-29T14:08:07+00:00,7 Best Cryptocurrencies Redditors Are Buying
231,AAPL,2022-09-29T14:32:07+00:00,Apple Hit With Rare Downgrade as BofA Sees Dominance at Risk
232,AAPL,2022-09-29T14:52:54+00:00,"Apple, Coinbase, DocuSign on the move following Wall Street analyst calls"
233,AAPL,2022-09-29T16:06:42+00:00,Stock Market Today: Dow Ends Lower as Bears Feast on Apple Dive
234,AAPL,2022-09-29T16:09:04+00:00,Shopify (SHOP) Unveils POS Go to Help Retail Merchants
235,AAPL,2022-09-29T16:54:44+00:00,Apple Braces For Second Faceoff Over Upcoming Union Election
236,AAPL,2022-09-29T17:45:00+00:00,"Apple stock may not be a ‘safe haven’ for much longer, Bank of America warns in downgrade"
237,AAPL,2022-09-29T18:04:00+00:00,"'Don't try to be a hero': The stock market will — eventually — roar back, history shows"
238,AAPL,2022-09-29T18:46:21+00:00,10 companies at risk from an Apple iPhone slowdown
239,AAPL,2022-09-29T18:56:38+00:00,Top Apple Executive Is Leaving After Making Crude Remarks in TikTok Video
240,AAPL,2022-09-29T19:21:31+00:00,New Antitrust Bill Will Bolster US Fight Against Tech Giants With Small Reforms
241,AAPL,2022-09-29T19:25:13+00:00,Apple: Analysts at odds with stock over waning iPhone 14 demand
242,AAPL,2022-09-29T19:57:43+00:00,"Meta to Cut Headcount for First Time, Slash Budgets Across Teams"
243,AAPL,2022-09-29T20:28:42+00:00,"Apple’s Ugly Day Wipes Out $120 Billion, Spills Over Big Tech"
244,AAPL,2022-09-29T20:37:00+00:00,Apple exec exits after coarse remarks captured in viral TikTok video: report
245,AAPL,2022-09-29T20:44:00+00:00,Mark Zuckerberg Freezes Hiring at Facebook-Parent Meta
246,AAPL,2022-09-29T20:49:43+00:00,Analysts are Downgrading These 10 Stocks
247,AAPL,2022-09-29T21:15:00+00:00,3 Dividend Stocks That Deliver High-Quality 'Returns'
248,AAPL,2022-09-29T21:23:07+00:00,"S&amp;P 500 Hits Fresh Lows As Bears Maul Again; Apple, Tesla, CarMax Dive, Nike Skids Late"
249,AAPL,2022-09-29T21:26:00+00:00,Apple Executive Leaves Company After Crude Joke Made in Viral TikTok Video
250,AAPL,2022-09-29T21:41:37+00:00,Apple senior exec leaves iPhone maker after remark in viral video
251,AAPL,2022-09-29T21:50:47+00:00,Why Skyworks Solutions Stock Tumbled on Thursday
252,AAPL,2022-09-29T22:09:58+00:00,7 Sleeper Growth Stocks to Buy Before Wall Street Wakes Up
253,AAPL,2022-09-29T22:31:07+00:00,"Dow Jones Futures: S&amp;P 500 Hits Fresh Lows As Apple, Tesla, CarMax Dive, Nike Plunges Late"
254,AAPL,2022-09-30T00:08:21+00:00,Exclusive-Senior Indonesian officials targeted by spyware last year – sources
255,AAPL,2022-09-30T01:43:50+00:00,Apple’s Tech Supply Chain Shows Difficulty of Dumping China
256,AAPL,2022-09-30T01:43:50+00:00,Apple’s Tech Supply Chain Shows Difficulty of Dumping China
257,AAPL,2022-09-30T06:00:00+00:00,India’s Manufacturing Push Is Working. Apple’s iPhone 14 Is the Newest Prize.
258,AAPL,2022-09-30T06:09:56+00:00,"Russian Annexation, Personal Income, Eurozone CPI - What's Moving Markets"
