,ticker,date,title
773,AAPL,2022-10-25T10:12:22+00:00,Apple Music more expensive than Spotify after price increase
774,AAPL,2022-10-25T10:36:43+00:00,"Alphabet, Microsoft Lead Bear-Market Earnings Season"
775,AAPL,2022-10-25T10:39:00+00:00,Big Tech Earnings Are Here. A Fed Slowdown Can’t Come Soon Enough.
776,AAPL,2022-10-25T10:59:11+00:00,15 Biggest Tech Stock Drops in 2022
777,AAPL,2022-10-25T11:10:00+00:00,"Solana Might Be Down 85%, But It Has a Jaw-Dropping Strategy to Bounce Back in 2023"
778,AAPL,2022-10-25T11:14:17+00:00,10 Penny Stocks Poised To Explode
779,AAPL,2022-10-25T11:17:54+00:00,UPDATE 1-Apple is cutting back production of iPhone 14 Plus due to weak demand - TrendForce
780,AAPL,2022-10-25T12:00:23+00:00,Here's Why We Think Apple (NASDAQ:AAPL) Is Well Worth Watching
781,AAPL,2022-10-25T12:05:00+00:00,iPad 2022 Review: Apple’s Basic Tablet Got a Face-Lift—but Is It Worth the Price Hike?
782,AAPL,2022-10-25T12:36:12+00:00,"The Zacks Analyst Blog Highlights Apple, Netflix, Disney and Amazon"
783,AAPL,2022-10-25T12:40:46+00:00,"Apple announces new clean energy investments, asks suppliers to decarbonize"
784,AAPL,2022-10-25T12:48:12+00:00,"The Zacks Analyst Blog Highlights Alphabet, Microsoft, Apple and Amazon"
785,AAPL,2022-10-25T13:30:00+00:00,Nasdaq Bear Market: 2 Warren Buffett Stocks to Buy Hand Over Fist
786,AAPL,2022-10-25T14:29:31+00:00,"Investors watch for recession clues in Big Tech earnings, beginning with Alphabet, Microsoft"
787,AAPL,2022-10-25T14:47:00+00:00,S&amp;P 500 Continues Advance as Falling Yields Boost Big Tech Ahead of Earnings
788,AAPL,2022-10-25T15:19:00+00:00,Apple to keep 30% fee for NFT trading on its apps
789,AAPL,2022-10-25T15:31:00+00:00,This one stock stands out when looking at key data from the FAANG+ group
790,AAPL,2022-10-25T15:45:00+00:00,Why Is Everyone Talking About Apple?
791,AAPL,2022-10-25T16:04:05+00:00,7 Dow Stocks to Sell Before They Tumble
792,AAPL,2022-10-25T16:12:00+00:00,"Apple TV+ price increase is another sign company is ‘building the next HBO,’ says analyst"
793,AAPL,2022-10-25T16:21:28+00:00,"Apple says issues with iMessage, FaceTime resolved"
794,AAPL,2022-10-25T16:30:00+00:00,Can Apple’s Screen Time Reports Actually Help Curb Your Phone Addiction?
795,AAPL,2022-10-25T16:32:37+00:00,Stock Market Today: Dow Continues March Higher as Falling Yields Bolster Tech
796,AAPL,2022-10-25T16:44:10+00:00,"UPDATE 2-Apple says issues with iMessage, FaceTime resolved"
797,AAPL,2022-10-25T17:24:44+00:00,Apple Tightens Its Rules On NFTs
798,AAPL,2022-10-25T18:02:39+00:00,Apple Stock Iron Condor Has 30% Potential Return On Risk
799,AAPL,2022-10-25T19:24:01+00:00,10 Best Stocks Under $10 To Buy Right Now
800,AAPL,2022-10-25T19:58:07+00:00,Apple Q4 Preview: Another EPS Beat Inbound?
801,AAPL,2022-10-25T20:11:35+00:00,Apple Pay Leads Among Wallets but Lags in Total Purchases
802,AAPL,2022-10-25T20:53:08+00:00,Apple's iPhone Revenue Set to Be Key in Q4 Earnings
803,AAPL,2022-10-25T21:33:09+00:00,Don't Overlook Service Revenues in Apple's Q4
804,AAPL,2022-10-26T03:39:14+00:00,"Apple Will Comply With iPhone USB-C Charger Law, Executive Says"
805,AAPL,2022-10-26T04:14:00+00:00,Apple Executives Say Privacy Controls and Advertising Can Coexist
806,AAPL,2022-10-26T04:26:00+00:00,Snap CEO Evan Spiegel Says Apple’s Privacy Changes Are Evolving to Help Developers
807,AAPL,2022-10-26T10:11:00+00:00,Apple's Most Important Catalyst Just Got Better
808,AAPL,2022-10-26T10:23:44+00:00,U.S. Stocks Mixed as Big Tech Outlooks Spark Growth Fears
809,AAPL,2022-10-26T12:15:07+00:00,Target boosts Apple at Target locations to 150 stores
810,AAPL,2022-10-26T12:15:34+00:00,Target adds more Apple mini-shops
811,AAPL,2022-10-26T12:34:12+00:00,Is a Surprise Coming for Apple (AAPL) This Earnings Season?
812,AAPL,2022-10-26T14:10:14+00:00,Apple critics hit out at latest App Store changes
813,AAPL,2022-10-26T14:12:02+00:00,Will Slowing Services Growth Hurt Apple's (AAPL) Q4 Earnings?
814,AAPL,2022-10-26T14:22:09+00:00,Apple has ‘no choice’ but to follow EU diktat on charging ports
815,AAPL,2022-10-26T14:26:40+00:00,"Intel's Mobileye to IPO at $21/share, WBD taps DC Studios co-heads, Apple to comply with USB-C mandate"
816,AAPL,2022-10-26T14:38:38+00:00,"Elon Musk isn’t even done buying Twitter, but he’s already picking a fight with Apple over Spotify and payment guidelines"
817,AAPL,2022-10-26T15:12:27+00:00,"Millennial, Gen Z Investors Favor Green Energy, EV Stocks In Q3"
818,AAPL,2022-10-26T15:22:00+00:00,Apple Concedes That it Must Make a Huge iPhone Change
819,AAPL,2022-10-26T15:43:19+00:00,"GDP Print, Apple Earnings, Amazon Outlook: 3 Things to Watch"
820,AAPL,2022-10-26T16:25:04+00:00,SONY Gears Up to Report Q2 Earnings: Here's What to Expect
821,AAPL,2022-10-26T17:09:05+00:00,Apple Q4 Results Expected to Lean on Services Gains
822,AAPL,2022-10-26T17:14:00+00:00,Apple Admits It's Going to Have to Change the iPhone Charger
823,AAPL,2022-10-26T18:06:00+00:00,"The Domino Effect: Apple, and the Market, Could Be Dragged Down by Alphabet’s Big Miss"
824,AAPL,2022-10-26T18:17:47+00:00,What Are The Best Stocks To Buy Right Now?
825,AAPL,2022-10-26T18:27:00+00:00,Apple says USB-C charging will be coming to iPhones
826,AAPL,2022-10-26T19:15:00+00:00,Elon Musk Joins Backlash Against Apple
827,AAPL,2022-10-26T19:33:01+00:00,"Apple's holiday quarter may face pressure from inflation, weak China demand"
828,AAPL,2022-10-26T19:35:15+00:00,Apple reportedly 'undercutting' other businesses through new app store rules
829,AAPL,2022-10-26T21:25:30+00:00,Dow Jones Futures: Meta Continues Tech Titans Meltdown With Apple On Deck
830,AAPL,2022-10-26T21:58:23+00:00,"Meta stock plunges on declining third-quarter revenue, weaker than expected outlook"
831,AAPL,2022-10-26T22:04:10+00:00,Will iPhone Revenue Boost Apple (AAPL) Stock?
832,AAPL,2022-10-27T01:21:27+00:00,"China smartphone shipments slid 11% in Q3, research firm says"
833,AAPL,2022-10-27T01:55:46+00:00,"UPDATE 1-China smartphone shipments slid 11% in Q3, research firm says"
834,AAPL,2022-10-27T04:01:00+00:00,Apple Earnings Are Decent in Otherwise Terrible Week for Tech
835,AAPL,2022-10-27T04:01:00+00:00,Apple Earnings Are on Deck as Consumer Demand Softens
836,AAPL,2022-10-27T06:56:44+00:00,Dow Futures Rise 140 Pts; Meta Platforms and GDP Data in Focus
837,AAPL,2022-10-27T08:06:19+00:00,Foxconn iPhone factory in China reels from Covid outbreak
838,AAPL,2022-10-27T09:30:00+00:00,Apple Set to Report Record Revenue as Investors Watch for Sluggish Demand
839,AAPL,2022-10-27T10:00:27+00:00,Big tech stocks will play a crucial role in the current rally: Morning Brief
840,AAPL,2022-10-27T12:25:08+00:00,Dow Jones Futures Rise Ahead Of Key Economic Data; Meta Crashes On Earnings; Apple Earnings Next
841,AAPL,2022-10-27T12:33:08+00:00,Dow Jones Futures Rally After Key Economic Data; Meta Crashes On Earnings; Apple Earnings Next
842,AAPL,2022-10-27T14:05:08+00:00,Dow Jones Rallies After Key Economic Data; Meta Crashes On Earnings; Apple Earnings Next
843,AAPL,2022-10-27T14:23:51+00:00,Apple to report earnings amid reports of weak iPhone 14 demand
844,AAPL,2022-10-27T14:51:39+00:00,10 Best Value Stocks To Buy According To Warren Buffett
845,AAPL,2022-10-27T14:51:39+00:00,"Apple stock: What to expect from earnings, iPhone 14 demand"
846,AAPL,2022-10-27T15:01:00+00:00,Facebook Parent Meta Shares Fall to New Multiyear Lows
847,AAPL,2022-10-27T15:10:24+00:00,Dow Jones Leads Mixed Action; What Apple's '3rd Strike' Could Mean For Stock Market
848,AAPL,2022-10-27T15:18:15+00:00,"What to expect from Apple, Amazon earnings"
849,AAPL,2022-10-27T15:38:53+00:00,S&amp;P 500 Slips as Mega Slide in Meta Weighs
850,AAPL,2022-10-27T16:11:45+00:00,"Stock Market Today: Dow Climbs as Caterpillar, Boeing Rally Offset Meta Meltdown"
851,AAPL,2022-10-27T16:33:48+00:00,Qualcomm Charges Arm For License And Trademark Dispute
852,AAPL,2022-10-27T16:51:24+00:00,Dow Jones Holds Gains; Apple's $88 Billion Sales Target On Deck; Amazon On Watch
853,AAPL,2022-10-27T17:32:28+00:00,"US STOCKS-Dow jumps on earnings boost, Meta drags Nasdaq lower"
854,AAPL,2022-10-27T18:29:42+00:00,"US STOCKS-Dow jumps, Nasdaq sinks on mixed earnings"
855,AAPL,2022-10-27T19:12:22+00:00,Big 4 tech stocks erasing a total of more than $190 billion in market cap
856,AAPL,2022-10-27T19:14:03+00:00,"Dow Futures Trade Lower, Amazon Tanks 12.7% After Earnings"
857,AAPL,2022-10-27T19:18:23+00:00,Costco Just Dropped These 10 Black Friday Deals -- and Some Are Starting October 31
858,AAPL,2022-10-27T20:56:22+00:00,"Apple earnings: 'There's a lot of wind at their backs,' analyst says"
859,AAPL,2022-10-27T20:59:17+00:00,"Stocks moving in after hours: Apple, Amazon, Intel, Pinterest, Deckers Outdoor"
860,AAPL,2022-10-27T21:20:57+00:00,"Apple Beats September-Quarter Goals On Strong iPhone, Mac Sales"
861,AAPL,2022-10-27T21:25:16+00:00,Amazon sheds $200bn in record-breaking tech rout
862,AAPL,2022-10-27T21:28:00+00:00,"Tech Live: Inside Apple’s Thinking on Privacy, Charging Ports"
863,AAPL,2022-10-27T21:31:28+00:00,"Dow Jones Futures: Apple Falls, Amazon Joins Megacap Earnings Meltdown"
864,AAPL,2022-10-27T21:45:09+00:00,Apple (AAPL) Q4 Earnings and Revenues Beat Estimates
865,AAPL,2022-10-27T21:58:09+00:00,"AAPL, PINS Beat; AMZN, INTC Mixed but Down"
866,AAPL,2022-10-27T22:07:50+00:00,"Stocks trending after hours: Apple, Amazon, Intel, and more"
867,AAPL,2022-10-27T22:43:44+00:00,"Apple Dodges Tech Rout, Even While Warning of Holiday Slowdown"
868,AAPL,2022-10-27T22:51:08+00:00,"Apple Tops Estimates, Declines to Offer Q1 Forecast"
869,AAPL,2022-10-27T22:53:00+00:00,Apple earnings beat as record back-to-school Mac sales outweigh a slight miss on iPhones
870,AAPL,2022-10-27T22:59:22+00:00,"Apple tops revenue estimates, misses on iPhone, iPad net sales"
871,AAPL,2022-10-27T23:04:31+00:00,7 Smart Stocks to Buy for an Income-Rich Retirement
872,AAPL,2022-10-27T23:24:37+00:00,How Meta Became the Market's Biggest Value Trap
873,AAPL,2022-10-28T00:01:08+00:00,Apple says it is facing ‘significant’ headwinds from strong US dollar
874,AAPL,2022-10-28T00:30:33+00:00,The iPhone Is Lone Bright Spot in Gloomy Quarter for Smartphones
875,AAPL,2022-10-28T01:01:37+00:00,Big Tech’s Dirty Supply Chains Undercut Climate Promises From HQ
876,AAPL,2022-10-28T01:09:21+00:00,Big Oil is Catching Up With Big Tech
877,AAPL,2022-10-28T02:00:51+00:00,Apple (AAPL) Q4 2022 Earnings Call Transcript
878,AAPL,2022-10-28T06:52:28+00:00,Covid Outbreak at China iPhone Plant Pushes Workers to the Edge
879,AAPL,2022-10-28T07:56:01+00:00,"Amazon, Capital One Fall Premarket; Apple, Pinterest, Intel, Exxon Mobil Rise"
880,AAPL,2022-10-28T09:10:00+00:00,Apple Music Just Raised Its Prices. Here's What It Means for Spotify
881,AAPL,2022-10-28T09:27:00+00:00,"Stocks Edge Lower; Apple, Amazon, Intel And Elon Musk In Focus - Five Things To Know"
882,AAPL,2022-10-28T09:32:31+00:00,"US STOCKS-Futures sink as grim forecasts from Amazon, Apple fan recession fears"
883,AAPL,2022-10-28T09:34:14+00:00,"Futures sink as grim forecasts from Amazon, Apple fan recession fears"
884,AAPL,2022-10-28T09:41:00+00:00,"With Talk of a Recession Brewing, Here's How Investors Can Prepare to Ride Out the Storm"
885,AAPL,2022-10-28T10:00:51+00:00,Apple offers a dim light in an otherwise ‘dark earnings season’: Morning Brief
886,AAPL,2022-10-28T10:05:00+00:00,Did Apple Just Stick a Pin in the Google-Facebook Duopoly?
887,AAPL,2022-10-28T10:17:00+00:00,"Apple Stock Higher On Q4 Earnings Beat, Hopeful Holiday Sales Forecast"
888,AAPL,2022-10-28T10:22:24+00:00,"One Year On, Metaverse Frenzy Yet to Yield Dividends"
889,AAPL,2022-10-28T10:34:00+00:00,Apple Is the Winner of a Gruesome Earnings Season. Maybe Buffett Was Right.
890,AAPL,2022-10-28T10:39:51+00:00,U.S. Stocks Climb on Better Than Expected Inflation Data
891,AAPL,2022-10-28T11:24:00+00:00,"Apple is a ‘bright spot’ amid the ‘carnage’ of Big Tech, analysts say after earnings"
892,AAPL,2022-10-28T11:49:00+00:00,Tech Boom Ends as Companies From Amazon to Meta Adjust to Turbulent Times
893,AAPL,2022-10-28T11:58:00+00:00,"ECB Tones It Down, GDP Intrique, Old-School Stocks Rule, Amazon in Depth"
894,AAPL,2022-10-28T12:05:00+00:00,7 Must-See Metrics Highlight Apple's Record Fiscal Fourth Quarter
895,AAPL,2022-10-28T12:11:04+00:00,"US STOCKS-Futures retreat as warnings from Amazon, Apple fan recession fears"
896,AAPL,2022-10-28T12:22:14+00:00,"Dow Jones Futures Fall Ahead Of Key Inflation Data; Amazon Dives, Apple Rallies On Earnings"
897,AAPL,2022-10-28T12:36:14+00:00,"Dow Jones Futures Reverse After Key Inflation Data; Amazon Dives, Apple Rallies On Earnings"
898,AAPL,2022-10-28T12:57:53+00:00,"Midday Movers: Amazon.com, Apple, Intel and More"
899,AAPL,2022-10-28T13:13:14+00:00,"Dow Jones Futures Rise On Key Inflation Data; Amazon Dives, Apple Rallies On Earnings"
900,AAPL,2022-10-28T13:39:55+00:00,"Stocks mixed at open, Apple gains, Amazon extends losses"
901,AAPL,2022-10-28T13:48:29+00:00,"S&amp;P 500 consolidates gains, mega-cap tech stocks lead"
902,AAPL,2022-10-28T13:49:21+00:00,Apple is now worth 9x more than Meta
903,AAPL,2022-10-28T14:05:00+00:00,"US Earnings to Watch: Pfizer, Qualcomm, CVS, Peloton, Coinbase, Uber"
904,AAPL,2022-10-28T14:05:14+00:00,"Dow Jones Rallies On Key Inflation Data; Amazon Dives, Apple Climbs On Earnings"
905,AAPL,2022-10-28T14:08:36+00:00,Exclusive: Construction could happen soon at Apple in RTP
906,AAPL,2022-10-28T14:13:57+00:00,11 Best Vanguard Stocks to Buy Now
907,AAPL,2022-10-28T14:24:25+00:00,S&amp;P 500 in Rally Mode as Apple Surge Lifts Big Tech
908,AAPL,2022-10-28T14:28:26+00:00,Apple's Steady Results Prove Why It's the Ultimate Warren Buffett Stock
909,AAPL,2022-10-28T14:38:17+00:00,US STOCKS-Wall Street rises as Apple boost outweighs Amazon gloom
910,AAPL,2022-10-28T14:46:34+00:00,Stock Market Ignores Tech Wreck; Amazon Shattered But Apple Higher
911,AAPL,2022-10-28T15:15:00+00:00,Apple Escapes the Tech Carnage: Here's What Traders Should Watch for Now
912,AAPL,2022-10-28T15:15:45+00:00,Apple Is the Only Big Tech Consolation in Wild $477 Billion Rout
913,AAPL,2022-10-28T15:27:48+00:00,"Apple Warns Of Holiday Sales Slowdown, Forecasts Big Drop In Mac Business"
914,AAPL,2022-10-28T15:28:49+00:00,"Apple caters to those ‘who want a premium experience,’ analyst says"
915,AAPL,2022-10-28T15:34:34+00:00,"Apple has balanced iPhone ‘pricing and volume fairly well,’ analyst says"
916,AAPL,2022-10-28T15:37:00+00:00,Apple stock surges toward best day since 2020 as it’s dubbed rare ‘bright spot’ amid Big Tech ‘carnage’
917,AAPL,2022-10-28T16:14:36+00:00,Stock Market Rally Resilient As Apple Bucks Megacap Meltdown: Weekly Review
918,AAPL,2022-10-28T16:19:00+00:00,Apple’s High Note Clears a Low Tech Bar
919,AAPL,2022-10-28T16:21:21+00:00,Stock Market Today: Dow Racks Up Gains as 'Solid' Apple Results Revive Tech Bids
920,AAPL,2022-10-28T17:52:41+00:00,"US STOCKS-Wall Street jumps about 2% on upbeat Apple results, hopes of slowing rate hikes"
921,AAPL,2022-10-28T17:53:01+00:00,"Google, Meta, Apple CEOs walk recession tightrope"
922,AAPL,2022-10-28T18:29:35+00:00,"US STOCKS-Wall Street jumps on solid earnings, encouraging data ahead of 'Fed week'"
923,AAPL,2022-10-28T18:55:13+00:00,Musk-Twitter deal caps off a brutal week for tech
924,AAPL,2022-10-28T19:00:02+00:00,Big-Tech Stocks Lose $400 Billion — And They’re Still Expensive
925,AAPL,2022-10-28T19:00:24+00:00,Top 10 Gainers on Friday
926,AAPL,2022-10-28T19:06:12+00:00,Who killed the social media ad boom?
927,AAPL,2022-10-28T19:26:00+00:00,Apple’s Stock Buyback Pace Hits Record $25.2 Billion
928,AAPL,2022-10-28T19:30:00+00:00,A $3 trillion loss: Big Tech’s horrible year is getting worse
929,AAPL,2022-10-28T19:59:32+00:00,"Why Shares of Nvidia, AMD, and Skyworks Are Rallying Today"
930,AAPL,2022-10-28T20:00:19+00:00,US STOCKS-Wall Street surges at end of volatile week ahead of Fed meeting
931,AAPL,2022-10-28T20:11:00+00:00,Apple Had a Good Day. It Gets Tougher From Here.
932,AAPL,2022-10-28T20:28:11+00:00,US STOCKS-Wall Street surges to sharply higher close ahead of Fed week
933,AAPL,2022-10-28T20:28:55+00:00,Which companies are bullish on their stock buyback programs ahead of 2023 tax law
934,AAPL,2022-10-28T20:55:30+00:00,Warren Buffett Stocks: Two Big Holdings Soared This Week — Besides Apple
935,AAPL,2022-10-28T21:35:00+00:00,These 2 Stock Winners Topped Apple's Big Gains Friday
936,AAPL,2022-10-28T22:00:56+00:00,Here's Why Apple Stock Soared Today
937,AAPL,2022-10-28T22:04:00+00:00,Weekly Roundup
938,AAPL,2022-10-28T22:44:10+00:00,Making Sense of Big Tech Earnings After Amazon and Meta Tumble
939,AAPL,2022-10-29T09:42:00+00:00,What Does Apple's Controversial NFT Policy Mean for Ethereum and Solana?
940,AAPL,2022-10-29T11:00:00+00:00,What to Watch as the Big Tech Companies Report Earnings
941,AAPL,2022-10-29T12:00:54+00:00,"Insiders at Apple Inc. (NASDAQ:AAPL) sold US$1.4m worth of stock, a potential red flag that needs to be monitored"
942,AAPL,2022-10-29T13:00:00+00:00,"Why the Future of the Computer Is Everywhere, All the Time"
943,AAPL,2022-10-29T15:34:00+00:00,"Company Report Roundup: Tesla, Tractor Supply, American Express, and More"
944,AAPL,2022-10-29T18:41:00+00:00,Target Makes a Big Bet on Apple
945,AAPL,2022-10-30T02:43:00+00:00,"Inside a Chinese iPhone Plant, Foxconn Grapples With Covid Chaos"
946,AAPL,2022-10-30T09:30:00+00:00,Rate Squeeze Punishes Once-Triumphant Tech Stocks
947,AAPL,2022-10-30T10:36:13+00:00,Workers Leave Biggest IPhone Plant to Escape Covid Curbs
948,AAPL,2022-10-30T10:59:34+00:00,Workers flee China’s Covid restrictions at Foxconn’s huge iPhone factory
949,AAPL,2022-10-30T14:59:00+00:00,Target Gives Apple Fans a Holiday Gift
950,AAPL,2022-10-30T20:30:40+00:00,20 Most Admired Companies in the World in 2022
951,AAPL,2022-10-31T01:54:40+00:00,IPhone Assembler Foxconn Moves to Limit Plant Disruption as Shares Slide
952,AAPL,2022-10-31T01:59:17+00:00,Output of Apple iPhones at major China plant could fall 30% amid COVID curbs -source
953,AAPL,2022-10-31T01:59:17+00:00,Exclusive-Foxconn COVID woes may hit up to 30% of iPhone Nov shipments from Zhengzhou plant - source
954,AAPL,2022-10-31T02:00:12+00:00,"After a Horrifying Week for Stocks, Big Tech Could be on its Last Breath"
955,AAPL,2022-10-31T06:41:29+00:00,China’s IPhone Sales Drop May Mean Bigger Problems for Apple
956,AAPL,2022-10-31T06:52:17+00:00,"Tesla-Glencore Talks, Russia Grain Deal, Lula Victory - What's Moving Markets"
957,AAPL,2022-10-31T07:00:00+00:00,"Big Pension Sells Apple, Block, and Estée Lauder Stock. Here’s What It Bought."
958,AAPL,2022-10-31T07:48:23+00:00,"Tesla, Apple, Petrobras Fall Premarket; Wynn Resorts Rises"
959,AAPL,2022-10-31T08:43:57+00:00,"WRAPUP 3-China COVID curbs hit iPhone output, shut Shanghai Disney"
960,AAPL,2022-10-31T08:43:57+00:00,"WRAPUP 1-China COVID curbs hit iPhone output, shut Shanghai Disney"
961,AAPL,2022-10-31T09:25:56+00:00,"IPhone Maker Lifts Wages, Preps Backup for Covid-Hit China Plant"
962,AAPL,2022-10-31T09:30:00+00:00,"Worker exodus, Covid-19 lockdown in world's largest iPhone factory hit Apple supply chain in China"
963,AAPL,2022-10-31T09:55:00+00:00,Apple Stock Slips As Key China iPhone Factory Hit By Covid Outbreak Reports
964,AAPL,2022-10-31T09:56:05+00:00,iPhone assembler Foxconn shifts production from China Covid-hit plant
965,AAPL,2022-10-31T10:00:00+00:00,Apple campus attracts more Cary development
966,AAPL,2022-10-31T10:10:00+00:00,3 Dividend-Paying Tech Stocks to Buy Right Now
967,AAPL,2022-10-31T11:10:00+00:00,"Stagnant Economy, Week That Was, Fed Slowdown? Earnings, 2 Notes of Caution"
968,AAPL,2022-10-31T12:03:12+00:00,"Amazon, Meta, Alphabet and Microsoft are part of Zacks Earnings Preview"
969,AAPL,2022-10-31T13:00:01+00:00,Apple Inc. (AAPL) Is a Trending Stock: Facts to Know Before Betting on It
970,AAPL,2022-10-31T13:37:00+00:00,Foxconn to Shift Some iPhone Production From Covid-Hit Plant to Other Sites
971,AAPL,2022-10-31T13:39:44+00:00,Bulls on Meta Stock Have One Big Problem: Mark Zuckerberg
972,AAPL,2022-10-31T13:41:22+00:00,Apple's Latest Price Changes Tell Investors a Lot About the Future of the Company
973,AAPL,2022-10-31T13:42:54+00:00,Spotify demands Apple is investigated for blocking updates to its audiobooks streaming service
974,AAPL,2022-10-31T14:05:02+00:00,5 Technology Stocks Poised to Beat Earnings Estimates in Q3
975,AAPL,2022-10-31T14:05:02+00:00,Earnings Erase $350B From Big Tech: 5 ETFs With Strength
976,AAPL,2022-10-31T14:29:00+00:00,Apple and Microsoft market caps reached their largest spread on record — at roughly Tesla’s entire valuation
977,AAPL,2022-10-31T14:36:32+00:00,"Chinese workers flee COVID lockdown at huge iPhone factory, potentially putting Apple in a bind as the holiday season draws near"
978,AAPL,2022-10-31T14:40:02+00:00,S&amp;P 500 Slips on Tech Wobble Ahead of Fed Meeting
979,AAPL,2022-10-31T14:42:45+00:00,US STOCKS-Wall St drops as megacaps weigh amid Fed rate debate
980,AAPL,2022-10-31T15:10:03+00:00,Apple Notches Best Day Since April 2020: 4 ETFs to Taste
981,AAPL,2022-10-31T15:14:05+00:00,This Industry Titan Is Buying Back Its Stock Hand Over Fist. Should Investors Follow?
982,AAPL,2022-10-31T16:16:41+00:00,Stock Market Today: Dow Slips But Notches Best Month in Decades; Fed in Focus
983,AAPL,2022-10-31T16:40:29+00:00,"Are Beaten-Down Tech Stocks A Buy? What To Watch In Apple, Microsoft, Intel, Amazon, Nvidia"
984,AAPL,2022-10-31T17:02:40+00:00,15 Biggest Global Tech Companies by Market Cap
985,AAPL,2022-10-31T17:18:18+00:00,7 Breakout Stocks to Buy That Are ‘Immune’ to Volatility
986,AAPL,2022-10-31T17:20:00+00:00,Apple stock dips amid questions about iPhone production disruptions at Foxconn
987,AAPL,2022-10-31T17:28:38+00:00,US STOCKS-Wall St drops as focus shifts to Fed rate decision
988,AAPL,2022-10-31T17:41:56+00:00,Apple/China: intricate supply chain makes hanging up hard to do
989,AAPL,2022-10-31T18:30:29+00:00,"Alphabet (Nasdaq: GOOGL), Microsoft (Nasdaq: MSFT) and Other Tech Giants hit by Slowing Growth and Rising Costs  - Our Takes on Big Tech Earnings"
990,AAPL,2022-10-31T18:36:49+00:00,Apple Provides Further Proof of Dominance in the Business World
991,AAPL,2022-10-31T18:37:00+00:00,Apple's Big Problem Gets Bigger
992,AAPL,2022-10-31T18:43:15+00:00,US STOCKS-Wall Street falls after two-week rally; eyes on Fed meeting
993,AAPL,2022-10-31T18:43:30+00:00,3 Technology Stocks With 3%+ Yields to Buy Today
994,AAPL,2022-10-31T18:49:00+00:00,"Apple, more than Meta, holds the key to unlocking a ‘metaverse’-type world of AR"
995,AAPL,2022-10-31T20:00:27+00:00,US STOCKS-Wall Street ends strong month on weaker note; focus on Fed meeting
996,AAPL,2022-10-31T20:10:00+00:00,Microsoft Struggles to Succeed in the Metaverse With HoloLens
997,AAPL,2022-10-31T20:12:05+00:00,Bulls on Meta Stock Have One Big Problem: Mark Zuckerberg
998,AAPL,2022-10-31T20:25:31+00:00,US STOCKS-Wall Street ends strong month on weaker note; focus on Fed meeting
999,AAPL,2022-10-31T22:10:14+00:00,Apple’s Online Store and Information Systems Chiefs Are Leaving
