,ticker,date,title
515,AAPL,2022-10-12T08:02:27+00:00,"UPDATE 1-Apple, Samsung to upgrade phone software in India for 5G roll out by Dec"
516,AAPL,2022-10-12T09:06:00+00:00,"If You Invested $10,000 In Apple for Its IPO In 1980, Here's How Much You'd Have Now"
517,AAPL,2022-10-12T09:34:00+00:00,The Long-Term Bull Case for Meta Platforms
518,AAPL,2022-10-12T09:50:00+00:00,3 Top Metaverse Stocks to Buy in October
519,AAPL,2022-10-12T10:16:48+00:00,Apple stock doesn't scare this analyst despite global slowdown
520,AAPL,2022-10-12T10:56:10+00:00,"The Zacks Analyst Blog Highlights HP, Dell, Apple and Lenovo"
521,AAPL,2022-10-12T11:52:59+00:00,"Apple, Samsung Smartphone Users Could Access 5G By December Via Software Upgrade"
522,AAPL,2022-10-12T12:15:24+00:00,"Dow Jones Futures Climb Ahead Of Key Inflation Data, Fed Minutes; PepsiCo Jumps On Earnings"
523,AAPL,2022-10-12T12:20:00+00:00,Is Apple stock a good hiding spot? Analysts can’t agree.
524,AAPL,2022-10-12T12:34:24+00:00,Dow Jones Futures Slash Gains On Hot Inflation Data; Fed Minutes Up Next; PepsiCo Jumps On Earnings
525,AAPL,2022-10-12T12:37:00+00:00,2 Top Buffett Stocks to Buy and Hold for the Long Haul
526,AAPL,2022-10-12T13:38:00+00:00,Apple's Entire iPad Family Is Discounted on Amazon
527,AAPL,2022-10-12T13:42:01+00:00,5 Stocks to Gain From the Flourishing Metaverse Space
528,AAPL,2022-10-12T13:50:24+00:00,Dow Jones Reverses On Hot Inflation Data; Fed Minutes Up Next; PepsiCo Jumps On Earnings
529,AAPL,2022-10-12T14:35:31+00:00,Citi remains bullish on Apple ahead of earnings report
530,AAPL,2022-10-12T14:41:04+00:00,14 Best Most Active Stocks To Buy Now
531,AAPL,2022-10-12T14:49:00+00:00,Apple Earnings Are Soon. Why This Analyst Isn’t Worried About the Stock.
532,AAPL,2022-10-12T16:10:04+00:00,Why Apple (AAPL) Could Beat Earnings Estimates Again
533,AAPL,2022-10-12T17:00:00+00:00,Google’s Pixel Phone and Watch Are Best Apple Alternatives Yet
534,AAPL,2022-10-12T18:11:44+00:00,Google’s Pixel Watch is an elegant smartwatch with tons of fitness and health features
535,AAPL,2022-10-12T20:00:00+00:00,"Taiwan Semiconductor’s Earnings Are Coming. Apple, China Headwinds Are in Focus."
536,AAPL,2022-10-12T20:02:00+00:00,Microsoft Teams up With Apple (This Might Just Be the Start)
537,AAPL,2022-10-12T20:08:30+00:00,Apple to Withhold Latest Employee Perks From Unionized Store
538,AAPL,2022-10-12T20:32:00+00:00,"Apple withholds new perks from unionized stores, Amazon workers prepare for union elections"
539,AAPL,2022-10-12T20:51:54+00:00,10 Most Anticipated Earnings to Watch in October
540,AAPL,2022-10-13T05:33:26+00:00,TSMC Earnings Top Estimates as Chip Industry Braces for Slowdown
541,AAPL,2022-10-13T08:17:00+00:00,Taiwan Semiconductor Warns of Weaker Demand Despite Profit Surge
542,AAPL,2022-10-13T09:04:00+00:00,Why Apple Stock Is Down 23% This Year
543,AAPL,2022-10-13T09:10:00+00:00,1 Reason You Don't Want to Own PC Makers Like HP and Dell Right Now
544,AAPL,2022-10-13T10:11:00+00:00,"5 Stocks That Turned a $5,000 Investment Into $1 Million"
545,AAPL,2022-10-13T10:23:19+00:00,Pinterest Leaves Peers in the Dust With 34% Rally
546,AAPL,2022-10-13T12:00:51+00:00,12 Best Big Tech Stocks to Buy Now
547,AAPL,2022-10-13T12:01:08+00:00,Estimating The Fair Value Of Apple Inc. (NASDAQ:AAPL)
548,AAPL,2022-10-13T12:03:12+00:00,"The Zacks Analyst Blog Highlights NVIDIA, Alphabet, Apple, Snap and Autodesk"
549,AAPL,2022-10-13T12:24:18+00:00,10 Best Fundamental Penny Stocks To Invest In
550,AAPL,2022-10-13T12:46:03+00:00,Dow Jones Futures Dive On Hot Inflation Report; 10-Year Treasury Yield Tops 4%
551,AAPL,2022-10-13T13:00:50+00:00,11 Best Dow Stocks To Buy Now
552,AAPL,2022-10-13T13:03:31+00:00,12 Best IoT Stocks to Buy Now
553,AAPL,2022-10-13T13:34:03+00:00,"Dow Jones Dives 500 Points On Hot Inflation Report; 10-Year Treasury Yield Tops 4%; Apple, Tesla Drop"
554,AAPL,2022-10-13T13:48:27+00:00,7 Gig Economy Stocks Set to Explode in 2023
555,AAPL,2022-10-13T14:00:00+00:00,Metaverse Woes: Meta Platforms Can't Even Get Its Own Employees Excited About the Metaverse
556,AAPL,2022-10-13T14:30:00+00:00,3 Incredibly Cheap Blue Chip Stocks to Buy Right Now
557,AAPL,2022-10-13T15:05:00+00:00,Apple Card Will Soon Let Users Grow Daily Cash Rewards While Saving For The Future
558,AAPL,2022-10-13T15:40:03+00:00,Microsoft (MSFT) Brings Apple iCloud Integration to Windows
559,AAPL,2022-10-13T15:50:28+00:00,Apple announces high-yield savings account for credit card holders
560,AAPL,2022-10-13T15:56:00+00:00,Apple to Offer High-Yield Savings Account From Goldman to Card Holders
561,AAPL,2022-10-13T16:35:00+00:00,Apple gets into the savings game as it deepens financial push
562,AAPL,2022-10-13T16:37:14+00:00,Apple Teams With Goldman Sachs to Offer Savings Accounts
563,AAPL,2022-10-13T16:42:32+00:00,7 Stocks to Buy Regardless of Q3 Earnings
564,AAPL,2022-10-13T16:52:39+00:00,Apple teams up with Goldman Sachs on high-yield savings account
565,AAPL,2022-10-13T17:21:04+00:00,Top 10 Stock Picks of Sander Gerber’s Hudson Bay Capital
566,AAPL,2022-10-13T19:05:41+00:00,"Big promises – but will Apple, VinFast, Wolfspeed deliver in NC? Report shows incentives don't always mean jobs"
567,AAPL,2022-10-13T19:58:36+00:00,"Brazil court fines Apple, orders to sell iPhone with charger"
568,AAPL,2022-10-13T21:46:53+00:00,3 Dow Stocks to Buy if You Are Feeling Greedy
569,AAPL,2022-10-14T09:30:00+00:00,Snap’s Stock Has Fallen Almost 80% This Year: What Went Wrong
570,AAPL,2022-10-14T09:35:00+00:00,Ready for Long-Term Growth? You Can't Go Wrong With These 3 Stocks
571,AAPL,2022-10-14T09:52:00+00:00,3 Best Buffett Stocks to Buy for the Long Haul
572,AAPL,2022-10-14T11:00:00+00:00,Microsoft Just Gave Meta Platforms a Big Vote of Confidence
573,AAPL,2022-10-14T12:15:00+00:00,Is This Top Warren Buffett Dividend Stock a Buy Now?
574,AAPL,2022-10-14T13:41:00+00:00,3 Reasons Apple Stock Is a Great Buy Today
575,AAPL,2022-10-14T14:03:01+00:00,S&amp;P 500 Stumbles as Signs of Higher for Longer Inflation Add to Fed Fears
576,AAPL,2022-10-14T15:54:03+00:00,"ROKU Expands The Roku Channel Internationally, Grows Library"
577,AAPL,2022-10-14T16:20:25+00:00,Stock Market Today: Dow Closes Lower as Rising Treasury Yields Dent Tech
578,AAPL,2022-10-14T16:22:04+00:00,Netflix (NFLX) Gears Up for Q3 Earnings: What's in the Cards?
579,AAPL,2022-10-14T17:00:20+00:00,What are the best iPad and tablet Black Friday deals? Here's what's expected in the 2022 UK sales
580,AAPL,2022-10-14T18:50:24+00:00,Apple to Launch a High-Yield Savings Account
581,AAPL,2022-10-14T18:50:42+00:00,LinkedIn co-founder Reid Hoffman: Tech has learned big lessons in 2022
582,AAPL,2022-10-14T21:32:44+00:00,"Apple: ‘Mobile computing and smartphones are here to stay,’ analyst says"
583,AAPL,2022-10-14T21:50:00+00:00,Weekly Roundup
584,AAPL,2022-10-15T01:30:10+00:00,Apple’s Oklahoma Store Is Second to Unionize After Vote
585,AAPL,2022-10-15T02:00:59+00:00,UPDATE 2-Apple workers vote to unionize second U.S. store
586,AAPL,2022-10-15T02:52:00+00:00,Apple Workers Vote for Union at Oklahoma Store in Second Organizing Win
587,AAPL,2022-10-15T11:20:00+00:00,An Investor's Look at Semiconductors
588,AAPL,2022-10-15T13:00:00+00:00,An Uneasy Use for Apple’s AirTags: Tracking a Loved One With Dementia
589,AAPL,2022-10-15T13:13:00+00:00,The top 25 market events of the last 25 years
590,AAPL,2022-10-15T14:30:00+00:00,3 Reasons Apple Is a Warren Buffett Stock
591,AAPL,2022-10-15T14:46:00+00:00,"Market News From AMD, McCormick, Peloton, and More"
592,AAPL,2022-10-16T11:11:00+00:00,"5 Stocks That Turned a $10,000 Investment Into $1 Million"
593,AAPL,2022-10-16T11:45:00+00:00,2 Top Tech Stocks to Buy During a Recession
594,AAPL,2022-10-16T12:45:00+00:00,Why Occidental Petroleum Could Be Warren Buffett's Next Apple
595,AAPL,2022-10-16T14:30:00+00:00,"$5,000 Invested in These Growth Stocks Could Make You Rich Over the Next 10 Years"
596,AAPL,2022-10-16T15:00:00+00:00,Satellite Mobile Phones Have a Long—and Not So Illustrious—Past
597,AAPL,2022-10-16T19:26:19+00:00,15 Best Countries to Live in the Future
598,AAPL,2022-10-16T21:42:00+00:00,Apple store workers in Oklahoma vote to unionize in another labor win
599,AAPL,2022-10-17T00:50:30+00:00,Asia Stocks Sink as China Chip Woes Worsen
600,AAPL,2022-10-17T04:01:18+00:00,UPDATE 1-Apple freezes plans to use China's YMTC chips - Nikkei
601,AAPL,2022-10-17T08:00:00+00:00,"Bank of America, Goldman Sachs, Splunk Rise Premarket; Fox Falls"
602,AAPL,2022-10-17T09:52:00+00:00,Here's the FAANG Stock Wall Street Thinks Will Soar the Most Over the Next 12 Months
603,AAPL,2022-10-17T10:53:15+00:00,Apple/China: suspending plan to use Yangtze chips means more local tech problems
604,AAPL,2022-10-17T12:00:52+00:00,"Top Indian Telecom Provider Inks 5G Contracts Wih Ericsson, Nokia"
605,AAPL,2022-10-17T12:03:46+00:00,Apple forced to cancel plans to buy memory chips from China after Biden’s crackdown
606,AAPL,2022-10-17T12:23:25+00:00,Dow Jones Futures Rally As Bank Of America Jumps On Earnings; Apple Called Top Pick
607,AAPL,2022-10-17T12:34:12+00:00,2 Stocks to Watch From the Challenging Computer Industry
608,AAPL,2022-10-17T13:00:37+00:00,Should You Investigate Apple Inc. (NASDAQ:AAPL) At US$138?
609,AAPL,2022-10-17T13:45:01+00:00,Why This 1 Growth Stock Could Be a Great Addition to Your Portfolio
610,AAPL,2022-10-17T13:53:00+00:00,Could TikTok's Music Streaming App Spell the End for Spotify?
611,AAPL,2022-10-17T14:05:25+00:00,Dow Jones Surges 600 Points As Bank Of America Jumps On Earnings; Apple Called Top Pick
612,AAPL,2022-10-17T15:53:45+00:00,Is Apple (AAPL) a Good Long-Term Bet?
613,AAPL,2022-10-17T16:22:00+00:00,"Apple Stock Is Top Pick, but Hardware Sector Set for Pain, Says Morgan Stanley"
614,AAPL,2022-10-17T16:22:11+00:00,Stock Market Today: Dow in Rally Mode as Bullish Banks Jump as Earnings Heat Up
615,AAPL,2022-10-17T17:03:05+00:00,Alphabet (GOOGL) Enhances YouTube With Homescreen Widgets
616,AAPL,2022-10-17T17:51:05+00:00,"Q3 Earnings Scorecard and Analyst Reports for Apple, Abbott, IBM &amp; Others"
617,AAPL,2022-10-17T20:34:48+00:00,11 Best Dividend Stocks to Buy According to Warren Buffett
618,AAPL,2022-10-17T20:45:18+00:00,7 Warren Buffett Stocks to Buy and Hold for the Next Decade
619,AAPL,2022-10-18T03:49:07+00:00,Goldman Sachs Extends Partnership with Apple
620,AAPL,2022-10-18T07:49:29+00:00,"Goldman Sachs, Johnson &amp; Johnson, Apple Rise Premarket; Hasbro Falls"
621,AAPL,2022-10-18T09:54:00+00:00,Apple Is Using Streaming to Unlock Another Growing Business
622,AAPL,2022-10-18T10:13:00+00:00,3 Growth Stocks to Buy in a Bear Market
623,AAPL,2022-10-18T11:25:11+00:00,"The Zacks Analyst Blog Highlights Apple, Abbott Laboratories, International Business Machines, Estee Lauder and Progressive"
624,AAPL,2022-10-18T12:26:08+00:00,Foxconn: electric car supply chain highlight risks to core Apple business
625,AAPL,2022-10-18T13:44:37+00:00,12 Best Fortune 500 Stocks to Buy Now
626,AAPL,2022-10-18T13:58:04+00:00,FuboTV (FUBO) Stock Is Heating Up on 2 Huge Catalysts
627,AAPL,2022-10-18T14:43:05+00:00,"Apple workers strike, Boeing to review 737 Max 7 documents, Joby seeks air certification in Japan"
628,AAPL,2022-10-18T15:00:00+00:00,Apple Introduces the Powerful Next-Generation Apple TV 4K
629,AAPL,2022-10-18T15:00:00+00:00,Apple Unveils Completely Redesigned iPad in Four Vibrant Colors
630,AAPL,2022-10-18T15:03:57+00:00,"Foxconn Wants To Make Tesla Cars After Fisker Pear EV, Apple iPhones"
631,AAPL,2022-10-18T15:35:00+00:00,Apple's Next-Gen Apple TV 4K Gets a Performance Boost and a Cheaper Price
632,AAPL,2022-10-18T15:37:57+00:00,S&amp;P 500 Rises as Strong Earnings Spark Rally; Apple Gives Up Some Gains
633,AAPL,2022-10-18T16:05:10+00:00,Apple introduces new products ahead of holiday shopping
634,AAPL,2022-10-18T16:05:33+00:00,Stock Market Today: Dow Rides Stronger Earnings to Close Higher
635,AAPL,2022-10-18T16:22:53+00:00,GME Stock: Short Sellers Are Sleepwalking Into Another Squeeze
636,AAPL,2022-10-18T16:30:00+00:00,"First-Edition Apple iPhone Sells for More Than $39,000 at Auction"
637,AAPL,2022-10-18T16:32:00+00:00,Apple’s iPad Gets a New Look and iPad Pros Get an M2 Chip Upgrade—Here’s the Full Lineup
638,AAPL,2022-10-18T17:10:43+00:00,10 Best S&amp;P 500 Stocks to Buy According to Hedge Funds
639,AAPL,2022-10-18T17:28:00+00:00,Apple introduces new iPad and iPad Pro with speed enhancements
640,AAPL,2022-10-18T17:48:05+00:00,Diving into the FAANG Stock Earnings Charts
641,AAPL,2022-10-18T18:26:00+00:00,Apple's 10th Gen iPad is the Biggest Redesign in Years
642,AAPL,2022-10-18T18:28:00+00:00,Apple's Latest iPad Pros Get The M2 Chip and a New Apple Pencil Trick
643,AAPL,2022-10-18T18:33:00+00:00,Apple Reports Next Week. Here’s What One Notable Analyst Will Be Watching.
644,AAPL,2022-10-18T18:40:00+00:00,"Apple Unveils New Products Ahead of the Holidays. The Company Is Flexing Its Muscles, Analyst Says."
645,AAPL,2022-10-18T18:45:49+00:00,"T-Mobile US' Pricing Power Of 5G Is A Pivot Point, Analyst Says"
646,AAPL,2022-10-18T18:51:06+00:00,Apple cuts production of iPhone 14 Plus - the Information
647,AAPL,2022-10-18T19:00:50+00:00,UPDATE 2-Apple cuts production of iPhone 14 Plus - the Information
648,AAPL,2022-10-18T19:03:57+00:00,"Apple Rounds Out Holiday Lineup With New iPads, TV Streaming Box"
649,AAPL,2022-10-18T19:21:26+00:00,Apple Unveils Upgraded iPads and Lower-Cost Set-Top TV Box
650,AAPL,2022-10-18T19:24:10+00:00,"Apple reportedly cuts production figures on iPhone 14 Plus, unveils redesigned iPad"
651,AAPL,2022-10-18T19:53:00+00:00,Apple Stock Slips on Report iPhone 14 Plus Production Was Cut on Weak Demand
652,AAPL,2022-10-18T21:45:09+00:00,Apple (AAPL) Gains But Lags Market: What You Should Know
653,AAPL,2022-10-19T01:29:28+00:00,7 Stocks to Buy When There’s Blood in the Streets
654,AAPL,2022-10-19T01:51:37+00:00,Asian Stocks Sink as China Slowdown Fears Persist
655,AAPL,2022-10-19T03:04:26+00:00,Global Smartphone Demand Continues Fall as Economic Woes Hit
656,AAPL,2022-10-19T11:40:40+00:00,Apple Cuts iPhone 14 Plus Production To Tap Demand For Premium iPhone Pro Models
657,AAPL,2022-10-19T11:55:25+00:00,Amazon Braces For UK's Insurance Market With Latest Offering
658,AAPL,2022-10-19T12:35:12+00:00,Dow Jones Futures Fall As Netflix Soars On Earnings; Tesla Earnings Next
659,AAPL,2022-10-19T12:59:27+00:00,US STOCKS-Wall St set to open lower as soaring Treasury yields dampen Netflix-led gains
660,AAPL,2022-10-19T13:32:12+00:00,Dow Jones Falls As Netflix Soars On Earnings; Tesla Earnings Next
661,AAPL,2022-10-19T15:16:38+00:00,US STOCKS-Wall St struggles to gain as soaring Treasury yields hurt earnings confidence
662,AAPL,2022-10-19T15:24:00+00:00,We're Reviewing the Earnings of 4 Portfolio Holdings and More
663,AAPL,2022-10-19T15:44:03+00:00,Apple (AAPL) Expands Portfolio With Redesigned &amp; Next-Gen iPads
664,AAPL,2022-10-19T17:12:52+00:00,3 Ways to Get Rich From Metaverse Stocks
665,AAPL,2022-10-19T17:27:44+00:00,7 Semiconductor Stocks to Buy When the Chips Are Down
666,AAPL,2022-10-19T17:52:27+00:00,The 3 Best Blue-Chip Stocks to Buy Now
667,AAPL,2022-10-19T17:56:00+00:00,"Apple Stock Is a Top Pick, and Sales Will Beat Estimates, Says Morgan Stanley"
668,AAPL,2022-10-19T18:42:56+00:00,Digital ad market shows 'signs of life' but economy clouds 2023 outlook
669,AAPL,2022-10-19T18:48:12+00:00,Why Meta Platforms Stock Was Outperforming the Market Today
670,AAPL,2022-10-19T20:34:49+00:00,The pandemic is finally hitting big tech — two years later
671,AAPL,2022-10-19T20:42:16+00:00,7 Semiconductor Stock Predictions for 2023
672,AAPL,2022-10-20T03:24:00+00:00,Elon Musk Says Tesla Will Snatch Apple's Crown
673,AAPL,2022-10-20T09:23:29+00:00,US chip curbs start to bite and India explores an e-rupee
674,AAPL,2022-10-20T09:35:00+00:00,My Top 2 Dividend Stocks to Buy Now
675,AAPL,2022-10-20T10:47:00+00:00,1 Semiconductor Stock Down 47% You May Regret Not Buying Hand Over Fist
676,AAPL,2022-10-20T11:11:11+00:00,MSCI Scheduled to Report Q3 Earnings: What's in the Cards?
677,AAPL,2022-10-20T14:01:02+00:00,Apple (AAPL) Earnings Expected to Grow: Should You Buy?
678,AAPL,2022-10-20T15:50:00+00:00,Tesla Took a Hit From the Strong Dollar. That’s Bad News for Apple.
679,AAPL,2022-10-20T15:53:07+00:00,11 Best Large Cap Stocks to Buy Now
680,AAPL,2022-10-20T18:41:53+00:00,7 Sizzling Stocks That Are Oblivious to the Manic Market
681,AAPL,2022-10-20T19:10:49+00:00,11 Best Income Stocks to Buy Right Now
682,AAPL,2022-10-20T20:13:12+00:00,Elon Musk Says Tesla Will Be Bigger Than Apple. Analysts Say Not So Fast
683,AAPL,2022-10-20T20:56:00+00:00,"Snap Stock Tumbles as Sales Growth Slows Further, Advertisers Cut Spending"
684,AAPL,2022-10-21T00:32:28+00:00,Foxconn imposes restrictions on iPhone assembly plant in China's Zhengzhou - SCMP
685,AAPL,2022-10-21T00:41:01+00:00,Foxconn imposes restrictions on iPhone assembly plant in China's Zhengzhou - SCMP
686,AAPL,2022-10-21T03:07:40+00:00,UPDATE 1-Foxconn says production normal at iPhone plant in China despite COVID curbs
687,AAPL,2022-10-21T09:06:00+00:00,77% of Warren Buffett's $313 Billion Portfolio Is Invested in These 6 Stocks
688,AAPL,2022-10-21T09:31:00+00:00,Zuckerberg's Metaverse Bet Is More Than Experimental - It's Key to Meta's Survival
689,AAPL,2022-10-21T10:22:02+00:00,Snap stock is crashing again — 3 big problems still lurk: Analyst
690,AAPL,2022-10-21T10:25:00+00:00,Want to Get Richer? 3 Top Stocks to Buy Now and Hold Forever
691,AAPL,2022-10-21T11:00:38+00:00,"With 53% ownership of the shares, Apple Inc. (NASDAQ:AAPL) is heavily dominated by institutional owners"
692,AAPL,2022-10-21T12:08:00+00:00,The Bad News for Apple in Tesla’s Earnings
693,AAPL,2022-10-21T12:15:18+00:00,Is Doom And Gloom In Store For Tech Stocks This Earnings Season?
694,AAPL,2022-10-21T14:05:02+00:00,What Lies Ahead for Big Tech ETFs in Q3 Earnings?
695,AAPL,2022-10-21T14:07:45+00:00,Wall Street looks ahead to Apple earnings following Netflix beat
696,AAPL,2022-10-21T14:08:02+00:00,ServiceNow (NOW) to Report Q3 Earnings: What's in the Cards?
697,AAPL,2022-10-21T14:09:02+00:00,Amphenol (APH) to Report Q3 Earnings: What's in the Cards?
698,AAPL,2022-10-21T14:11:12+00:00,"2 Reasons to Buy Apple Stock, and 1 Reason to Sell"
699,AAPL,2022-10-21T14:38:16+00:00,"US Earnings to Watch This Week: Apple, Microsoft, Boeing, Exxon, Biogen"
700,AAPL,2022-10-21T15:00:45+00:00,Apple's Design Chief to Leave After Replacing Ive
701,AAPL,2022-10-21T15:05:13+00:00,S&amp;P 500 Rising on Hopes of Fed Mulling Slowdown in Rate Hikes
702,AAPL,2022-10-21T15:19:30+00:00,Apple's industrial design head Hankey to leave - Bloomberg News
703,AAPL,2022-10-21T15:41:44+00:00,Apple’s Industrial Design Chief Hankey to Leave Three Years After Ive
704,AAPL,2022-10-21T16:05:12+00:00,Merck Stock In Bullish Setup Ahead Of Q3 Results; Apple Leads FAANG Earnings Barrage
705,AAPL,2022-10-21T16:14:07+00:00,Stock Market Today: Dow in Best Week Since June as Hopes on Slowing Hikes Emerge
706,AAPL,2022-10-21T16:15:54+00:00,Why Snap Stock Got Crushed Early Friday
707,AAPL,2022-10-21T16:47:04+00:00,"Snap ‘may have to go deeper’ in laying off workers, analyst warns"
708,AAPL,2022-10-21T17:37:31+00:00,The real trade war with China has begun
709,AAPL,2022-10-21T17:43:27+00:00,Apple iPhone 14 Pro Sales Seen Boosting September-Quarter Results
710,AAPL,2022-10-21T17:55:00+00:00,The 2021 Apple TV 4K Just Hit It's Lowest Price Ever on Amazon
711,AAPL,2022-10-21T18:54:00+00:00,Apple Loses Another Design Leader
712,AAPL,2022-10-21T19:02:04+00:00,AT&amp;T CFO: Phone bill delinquency rates ‘slightly worse than pre-pandemic norms’
713,AAPL,2022-10-21T19:32:37+00:00,Apple starts selling smart locks for homes that are compatible with personal devices
714,AAPL,2022-10-21T19:38:44+00:00,"Apple Loses Crucial Design Chief, Casting Concerns Over Its AR, VR, Electric Car Prospects"
715,AAPL,2022-10-21T19:49:00+00:00,Apple earnings: What do the iPhone production reports really mean?
716,AAPL,2022-10-21T21:03:13+00:00,Market Rally Steps Up: Apple Headlines Earnings Wave; 5 Growth Stocks Near Buy Points
717,AAPL,2022-10-21T21:10:00+00:00,Taylor Swift's Midnights is Here and it Sounds Great on AirPods Pro
718,AAPL,2022-10-21T21:15:00+00:00,This Hugely Popular 3-in-1 Wireless Fast Charger is on Sale
719,AAPL,2022-10-21T22:06:09+00:00,Megacap earnings to test fledgling U.S. stock rebound
720,AAPL,2022-10-21T22:35:00+00:00,Weekly Roundup
721,AAPL,2022-10-21T22:54:13+00:00,"Market Rally Steps Up, But Apple, Big Earnings Due; 5 Growth Stocks Near Buy Points"
722,AAPL,2022-10-21T23:19:13+00:00,"Market Rally Roars, 5 Growth Stocks Near Buy Points; Apple, Big Earnings Due"
723,AAPL,2022-10-22T01:17:21+00:00,7 Virtual Reality Stocks to Buy to Bet on the Coming VR Boom
724,AAPL,2022-10-22T10:06:00+00:00,This Dow Jones Stock Is a No-Brainer for Dividend Growth
725,AAPL,2022-10-22T13:00:08+00:00,What I Expect From the FAANG Stocks’ Earnings Next Week
726,AAPL,2022-10-23T11:00:00+00:00,iPadOS 16 Tips and Tricks: Apple’s Tablet Gets More Multitasking Features
727,AAPL,2022-10-23T12:48:57+00:00,3 Stocks to Buy With Your Social Security Increase
728,AAPL,2022-10-23T14:04:00+00:00,Snap's Stock Crashes as Apple's Policy Changes Crimp Advertiser Demand
729,AAPL,2022-10-23T16:04:13+00:00,"Dow Jones Futures: Market Rally Roars, 5 Growth Stocks Near Buy Points; Apple, Big Earnings Due"
730,AAPL,2022-10-23T16:53:00+00:00,"Big Tech has been an earnings refuge for years, but safety is no longer a sure thing"
731,AAPL,2022-10-23T19:30:03+00:00,Dow Futures Lift After Indices Post Best Week Since June
732,AAPL,2022-10-23T22:31:13+00:00,"Dow Jones Futures Rise: Market Rally Roars, 5 Growth Stocks Near Buy Points; Apple, Big Earnings Due"
733,AAPL,2022-10-24T00:53:13+00:00,"Dow Jones Futures Signal Market Rally Will Extend Gains; Tesla Cuts Model 3, Y Prices In China"
734,AAPL,2022-10-24T04:00:01+00:00,TSMC: the Taiwanese chipmaker caught up in the tech cold war
735,AAPL,2022-10-24T10:30:27+00:00,7 Top-Rated Large-Cap Stocks to Buy and Hold
736,AAPL,2022-10-24T11:00:00+00:00,"Buy An Apple iPhone, Fund Mangrove Restoration Projects"
737,AAPL,2022-10-24T12:17:15+00:00,"Chinese Top Chipmaker Retaliates By Firing US Employees In Core Tech, Former CEO's Position Remain Undecided"
738,AAPL,2022-10-24T12:58:12+00:00,Apple (AAPL) to Report Q4 Earnings: What's in the Offing?
739,AAPL,2022-10-24T13:00:00+00:00,"Apple 10th Gen iPad Review: Modern Build, Modern Speeds"
740,AAPL,2022-10-24T13:00:01+00:00,Wolfspeed (WOLF) to Report Q1 Earnings: What's in the Cards?
741,AAPL,2022-10-24T13:05:01+00:00,"Alphabet, Microsoft, Meta Platforms, Apple and Amazon are part of Zacks Earnings Preview"
742,AAPL,2022-10-24T13:25:09+00:00,"Tech giants set to report earnings this week: Google, Microsoft, Meta, Apple, Amazon"
743,AAPL,2022-10-24T14:00:44+00:00,Stocks opened mixed ahead of Big Tech earnings
744,AAPL,2022-10-24T15:29:24+00:00,"Apple, Meta among Big Tech stocks to watch as U.S. dollar strengthens"
745,AAPL,2022-10-24T15:37:00+00:00,"High-Risk Week for Apple, Alphabet, Amazon, Microsoft and Meta"
746,AAPL,2022-10-24T16:13:00+00:00,"Meta Should Cut Staff 20% And Slash Spending On The Metaverse, Investor Says"
747,AAPL,2022-10-24T17:24:00+00:00,Apple Music and Apple TV+ prices are going up. Here’s how much you’ll soon pay for streaming.
748,AAPL,2022-10-24T17:35:45+00:00,PayPal Enables Secure Login Via Cryptographic Key Pairs
749,AAPL,2022-10-24T17:40:00+00:00,Apple Raises Prices for Streaming Music and Video
750,AAPL,2022-10-24T17:53:35+00:00,Apple raises prices of its services as media executives double down on price hikes
751,AAPL,2022-10-24T17:54:07+00:00,Apple Hikes Music and TV+ Prices in First Increases Since Launch
752,AAPL,2022-10-24T18:34:15+00:00,Apple raises prices of TV and music streaming subscriptions
753,AAPL,2022-10-24T18:52:48+00:00,Layoff Watch: 3 Stocks Set to Be Rocked by Massive Job Cuts
754,AAPL,2022-10-24T19:25:00+00:00,"Apple Music, Apple TV+, Apple One Now Cost More"
755,AAPL,2022-10-24T19:35:38+00:00,Why Meta Platforms Stock Was Volatile on Monday
756,AAPL,2022-10-24T20:27:44+00:00,Apple CEO Tim Cook thought U2 putting its album on your iPhone was ‘not right’—even though he did it anyway
757,AAPL,2022-10-24T20:30:39+00:00,"Meta has 'a tough vision' in selling the metaverse to Wall Street, strategist says"
758,AAPL,2022-10-24T20:54:57+00:00,"Dow Jones Rallies 400 Points, What To Do Now; Alphabet, Apple, Meta, Microsoft To Report"
759,AAPL,2022-10-24T21:31:50+00:00,Apple Refuses to Exempt NFTs From App Store’s 30% Fee
760,AAPL,2022-10-24T21:34:45+00:00,'It's not surprising': Why Apple is raising subscription prices now
761,AAPL,2022-10-24T22:00:10+00:00,"Markets Up Big from a Month Ago, Earnings On Deck"
762,AAPL,2022-10-24T22:09:10+00:00,Take a Bite in Apple Stock Before Earnings?
763,AAPL,2022-10-24T23:07:59+00:00,UK regulator warns over Big Tech’s growing interest in finance
764,AAPL,2022-10-24T23:08:00+00:00,Apple Plans to Quietly Give You More Ads
765,AAPL,2022-10-25T00:23:00+00:00,Apple CEO Tim Cook Gets Roasted For How He Did This
766,AAPL,2022-10-25T04:36:45+00:00,PRESS DIGEST- Wall Street Journal - Oct 25
767,AAPL,2022-10-25T05:53:31+00:00,Apple Issues New App Store Rules for Crypto and NFT Payments
768,AAPL,2022-10-25T06:55:57+00:00,Dow Futures Slide 130 Pts as Investors Await Big Tech Earnings
769,AAPL,2022-10-25T08:06:00+00:00,Universal Music shares surge on rising Apple music subscription prices
770,AAPL,2022-10-25T09:09:00+00:00,Apple Updates Rules on NFTs and Cryptocurrencies. What They Mean.
771,AAPL,2022-10-25T09:39:13+00:00,Apple is cutting back production of iPhone 14 Plus due to weak demand - TrendForce
772,AAPL,2022-10-25T09:39:13+00:00,Apple is cutting back production of iPhone 14 Plus due to weak demand - TrendForce
