,ticker,date,title
259,AAPL,2022-09-30T07:49:32+00:00,Sterling almost erases losses from Kwasi Kwarteng’s mini-Budget
260,AAPL,2022-09-30T07:49:32+00:00,Sterling nearly erases losses from Kwasi Kwarteng’s ‘mini’ Budget
261,AAPL,2022-09-30T09:30:00+00:00,Apple’s Car-Crash Detection—Tested by a Demolition-Derby Driver
262,AAPL,2022-09-30T09:55:00+00:00,Warren Buffett's Top 3 Dividend Stocks: Are They Buys Now?
263,AAPL,2022-09-30T10:06:57+00:00,Tencent Loses Crown in World’s Biggest Stock Wipeout
264,AAPL,2022-09-30T10:19:07+00:00,Dow Jones Futures Rise As Treasury Yields Fall With Inflation Data Due; Nike Dives On Inventories
265,AAPL,2022-09-30T10:39:00+00:00,The First Three Quarters of 2022 Have Been Bad. The Fourth Could Be Worse.
266,AAPL,2022-09-30T10:56:00+00:00,Here’s why investors should start betting on Apple and the stock market now
267,AAPL,2022-09-30T11:12:07+00:00,"Dow Jones Futures Pare Gains, Treasury Yields Fall With Inflation Data Due; Nike Dives On Inventories"
268,AAPL,2022-09-30T12:08:07+00:00,Dow Jones Futures: Treasury Yields Fall With Inflation Data Due; Nike Dives On Inventories
269,AAPL,2022-09-30T12:09:20+00:00,Dow Jones Futures Rise Ahead Of Key Inflation Data; Tesla Stock Climbs Before AI Day
270,AAPL,2022-09-30T12:43:00+00:00,"Intel's Dividends Can Hold Up, But The Business Faces Uncertainty In The Future"
271,AAPL,2022-09-30T12:52:20+00:00,Dow Jones Futures Reverse Lower On Hot Inflation Data; Tesla Stock Falls Before AI Day
272,AAPL,2022-09-30T12:57:20+00:00,"Midday Movers: Carnival Corp., Nike, Apple and More"
273,AAPL,2022-09-30T13:00:01+00:00,Apple Inc. (AAPL) Is a Trending Stock: Facts to Know Before Betting on It
274,AAPL,2022-09-30T13:07:01+00:00,"Stock Market News for Sep 30, 2022"
275,AAPL,2022-09-30T13:19:00+00:00,Top 10 Stock Picks of Dmitry Balyasny’s Hedge Fund
276,AAPL,2022-09-30T13:28:00+00:00,5 Ways to Stress-Test a Stock in a Bear Market
277,AAPL,2022-09-30T13:31:20+00:00,Dow Jones Drops On Hot Inflation Data; Tesla Stock Falls Before AI Day
278,AAPL,2022-09-30T14:03:44+00:00,Apple executive sacked after joke about fondling women
279,AAPL,2022-09-30T14:07:00+00:00,Dow Jones Bear Market: 2 Warren Buffett Stocks You Can Buy Today
280,AAPL,2022-09-30T14:34:47+00:00,"Apple exec departs after TikTok remarks, Disney+ gets new president, Google to sunset Stadia"
281,AAPL,2022-09-30T14:39:00+00:00,"Apple, Alphabet, Amazon, Tesla, Microsoft and Meta Lost $260Bn in 24 Hours"
282,AAPL,2022-09-30T15:21:03+00:00,10 Best Multibagger Stocks to Buy Now
283,AAPL,2022-09-30T15:27:03+00:00,"Meta trades at pre-pandemic levels, Apple down 9.6% for the month"
284,AAPL,2022-09-30T16:04:56+00:00,"Tech stocks slip amid economic uncertainty, investor fears"
285,AAPL,2022-09-30T17:00:00+00:00,Apple NFTs: Everything You Need to Know
286,AAPL,2022-09-30T17:36:00+00:00,Apple's M2 and M1 MacBook Airs Are at the Lowest Prices We've Seen
287,AAPL,2022-09-30T18:33:00+00:00,Does Apple’s Crash Detection Work? We Totaled Some Cars to Find Out.
288,AAPL,2022-09-30T18:45:17+00:00,Jamf Analysts Find Apple As A Significant Competitive Advantage; Hail Its Growth Alongside Players Like Microsoft
289,AAPL,2022-09-30T19:50:14+00:00,Discount Rates: Look Out Below
290,AAPL,2022-09-30T20:25:00+00:00,Apple Stock Had an Awful September. But the Quarter Wasn’t Half-Bad.
291,AAPL,2022-09-30T21:48:59+00:00,Apple Is Popular but Overvalued
292,AAPL,2022-09-30T22:07:03+00:00,Apple has forced out a top operations exec after he made crude comments in a TikTok video
293,AAPL,2022-09-30T22:43:00+00:00,Weekly Roundup
294,AAPL,2022-10-01T04:00:00+00:00,The Next Big Battle Between Google and Apple Is for the Soul of Your Car
295,AAPL,2022-10-01T09:52:00+00:00,"3 Stocks to Buy In October That Could Soar 47% to 84%, According to Wall Street"
296,AAPL,2022-10-01T12:00:00+00:00,Dealing With Stock Market Pessimism
297,AAPL,2022-10-01T12:00:16+00:00,"If EPS Growth Is Important To You, Apple (NASDAQ:AAPL) Presents An Opportunity"
298,AAPL,2022-10-01T13:00:00+00:00,Your Watch Says You Have a Heart Condition. Now What?
299,AAPL,2022-10-01T14:10:00+00:00,Amazon's Second Selling Bonanza of 2022: Who Benefits?
300,AAPL,2022-10-01T14:21:36+00:00,Why These 10 Stocks Trended This Week
301,AAPL,2022-10-01T20:51:41+00:00,5 Best Stocks to Buy if You Have $250 to Spend
302,AAPL,2022-10-02T09:30:00+00:00,"Apple’s Fall 2022 Event Products: Reviews of iPhone 14, iOS 16, Apple Watch Ultra, AirPods Pro 2 and More"
303,AAPL,2022-10-02T10:45:00+00:00,3 Spring-Loaded Stocks Ready to Soar When the Bear Market Ends
304,AAPL,2022-10-02T13:45:00+00:00,Will Amazon Be Worth More Than Apple by 2025?
305,AAPL,2022-10-02T14:00:00+00:00,3 Stocks to Avoid This Week
306,AAPL,2022-10-03T01:38:00+00:00,"Apple CEO Tim Cook predicts AR will have ‘profound’ impact, downplays metaverse"
307,AAPL,2022-10-03T04:00:55+00:00,The race to reinvent the space station
308,AAPL,2022-10-03T09:40:05+00:00,7 things to watch after a cold quarter for the stock market: Morning Brief
309,AAPL,2022-10-03T11:00:06+00:00,7 Cheap Cathie Wood Stocks to Buy in October
310,AAPL,2022-10-03T12:00:12+00:00,4 Best ETF Areas of Last Week That Are Up At Least 5%
311,AAPL,2022-10-03T13:10:01+00:00,AVID Introduces Pro Tools Upgrades for the Music Community
312,AAPL,2022-10-03T13:30:01+00:00,Alphabet (GOOGL) Boosts YouTube Music With Autoplay Filters
313,AAPL,2022-10-03T14:30:22+00:00,"Apple confronting a ‘broader spending deceleration,’ analyst says"
314,AAPL,2022-10-03T14:31:33+00:00,Apple loses second bid to challenge Qualcomm patents at U.S. Supreme Court
315,AAPL,2022-10-03T15:17:03+00:00,Amazon (AMZN) Boosts Smart Speaker Portfolio With Echo Devices
316,AAPL,2022-10-03T15:48:43+00:00,S&amp;P 500 Rallies as Grim Economic Data Fuels Bets on Fed Pause
317,AAPL,2022-10-03T15:51:37+00:00,"Tim Cook downplays the metaverse, saying 'I’m really not sure the average person can tell you what [it] is'"
318,AAPL,2022-10-03T16:07:23+00:00,Stock Market Today: Dow in Strong Start to October as Bets on Fed Pivot Rise
319,AAPL,2022-10-03T17:37:00+00:00,Apple Music celebrates 100 million song milestone
320,AAPL,2022-10-03T18:00:06+00:00,Best Inverse/Leveraged ETFs of Last Week
321,AAPL,2022-10-03T18:35:00+00:00,"Apple: Heavily Scrutinized, Yet Still Underestimated"
322,AAPL,2022-10-03T19:41:49+00:00,Apple loses bid to cancel Qualcomm smartphone patent in the U.S. Supreme Court
323,AAPL,2022-10-03T20:24:00+00:00,"Will Smith’s ‘Emancipation’ Will Be in Theaters Dec. 2, Apple Says"
324,AAPL,2022-10-03T21:12:25+00:00,"Why stock market investors should be bullish despite recent volatility, according to a strategist"
325,AAPL,2022-10-03T21:36:34+00:00,Why Qualcomm Stock Surged Higher Today
326,AAPL,2022-10-03T23:31:57+00:00,This Is the Best Time to Buy These 7 Long-Term Stocks
327,AAPL,2022-10-04T05:00:00+00:00,Apple and Tesla Aren’t the Stock They Were in August. Here’s What Has Changed.
328,AAPL,2022-10-04T06:33:45+00:00,Apple iPhone Exports From India Doubling in Boon to Modi’s Plan
329,AAPL,2022-10-04T07:09:19+00:00,Apple iPhone exports from India top $1 billion in 5 months - Bloomberg News
330,AAPL,2022-10-04T07:21:02+00:00,"Rivian, Poshmark, Tesla Rise Premarket; Kalvista Pharmceuticals Falls"
331,AAPL,2022-10-04T08:02:01+00:00,UPDATE 1-Apple iPhone exports from India top $1 bln in 5 months - Bloomberg News
332,AAPL,2022-10-04T08:02:24+00:00,UPDATE 2-Apple supplier Foxconn 'cautiously optimistic' about Q4 outlook
333,AAPL,2022-10-04T09:05:00+00:00,"Down 30%, Is Microsoft Stock a Buy Now?"
334,AAPL,2022-10-04T09:41:06+00:00,India-Made iPhone Exports Meets With Success As China's COVID-19 Lockdowns Weigh
335,AAPL,2022-10-04T09:52:00+00:00,3 Warren Buffett Stocks Most Likely to Soar in Q4
336,AAPL,2022-10-04T10:21:59+00:00,"Amazon stock has gotten too cheap to ignore, analyst argues"
337,AAPL,2022-10-04T10:38:04+00:00,"UPDATE 2-EU approves phone charger reform, forcing Apple to adapt"
338,AAPL,2022-10-04T10:45:00+00:00,Better Buy: Apple Stock or the Entire Nasdaq?
339,AAPL,2022-10-04T10:58:39+00:00,"Trump-Tied SPAC, Rumble Show Power of Hardcore Followers"
340,AAPL,2022-10-04T11:20:00+00:00,The Bull Case for Intel: TSMC's Crazy Pricing Power
341,AAPL,2022-10-04T12:27:52+00:00,"Dow Jones Futures Advance As Treasury Yields Tumble; Apple, Tesla Rally"
342,AAPL,2022-10-04T12:51:00+00:00,European Parliament approves universal charger rules opposed by Apple
343,AAPL,2022-10-04T13:04:51+00:00,"For Apple, Europe's Phone Charger Reform Holds These Pros And Cons"
344,AAPL,2022-10-04T13:31:52+00:00,"Dow Jones Advances As Treasury Yields Tumble; Apple, Tesla Rally"
345,AAPL,2022-10-04T13:31:56+00:00,3 No-Brainer Warren Buffett Stocks to Buy Right Now
346,AAPL,2022-10-04T13:55:52+00:00,"Dow Jones Surges 600 Points As Treasury Yields Tumble; Apple, Tesla Rally"
347,AAPL,2022-10-04T14:12:02+00:00,Charter's (CHTR) Spectrum News Beats Peers for Daily Views
348,AAPL,2022-10-04T14:40:02+00:00,DELL Rides on Strong Partner Base Amid Growing Challenges
349,AAPL,2022-10-04T15:02:00+00:00,Is This a Red Flag for TSMC Stock?
350,AAPL,2022-10-04T15:10:03+00:00,ROKU Enables Cross Media Measurements Along With Nielsen
351,AAPL,2022-10-04T15:22:00+00:00,"Apple Suppliers Add Manufacturing Sites in U.S., With Focus on California"
352,AAPL,2022-10-04T15:46:00+00:00,Apple Told to Ditch Unique iPhone Charger in EU
353,AAPL,2022-10-04T15:57:53+00:00,EU leaves Apple in a tangle amid fight for USB-C standardization
354,AAPL,2022-10-04T17:58:00+00:00,Apple Loses Major Court Case
355,AAPL,2022-10-04T18:28:19+00:00,Apple Receives Complaint From Labor Board in New York Case
356,AAPL,2022-10-04T19:00:45+00:00,Long-Term Stock Portfolio: 11 Tech Stocks To Consider
357,AAPL,2022-10-04T19:24:11+00:00,Dow Jones Rallies; Twitter Stock Rockets As Elon Musk Bites This Bullet; These New Cathie Wood Buys Soar
358,AAPL,2022-10-04T20:21:11+00:00,Dow Jones Rallies; These New Cathie Wood Buys Soar; Twitter Stock Flies As Elon Musk Bites Takeover Bullet
359,AAPL,2022-10-04T20:21:11+00:00,Dow Jones Surges; Twitter Stock Rockets As Elon Musk Bites This Bullet; These New Cathie Wood Buys Soar
360,AAPL,2022-10-04T20:55:07+00:00,Dow Jones Jumps Again On Fed Hopes; Twitter Stock Skyrockets As Tesla's Elon Musk Gives In
361,AAPL,2022-10-04T20:59:37+00:00,What EU's USB-C mandate may mean for Apple
362,AAPL,2022-10-04T21:03:10+00:00,"Stocks moving inn after hours: Twitter, Amylyx Pharmaceuticals, AutoZone, Airbnb"
363,AAPL,2022-10-04T22:22:09+00:00,Apple suppliers moved operations closer to Cupertino amid pandemic
364,AAPL,2022-10-05T07:13:08+00:00,"UPDATE 1-Apple asks suppliers to shift some AirPods, Beats production to India - Nikkei"
365,AAPL,2022-10-05T09:21:00+00:00,All Signs Point to Warren Buffett Buying His Favorite Stock Again
366,AAPL,2022-10-05T10:06:58+00:00,5 reasons why the stock market suddenly roared back
367,AAPL,2022-10-05T10:38:07+00:00,Dow Jones Futures Fall After Market Rallies On Fed Hopes; Twitter Skyrockets As Elon Musk Gives In
368,AAPL,2022-10-05T11:01:55+00:00,Does Apple (NASDAQ:AAPL) Deserve A Spot On Your Watchlist?
369,AAPL,2022-10-05T11:24:52+00:00,"India Scores More Wins At The Cost Of China; Apple AirPods, Beats Production Could Soon Shift To The Country"
370,AAPL,2022-10-05T12:10:00+00:00,Here Are 3 Long-Term Reasons to Buy Apple Today
371,AAPL,2022-10-05T12:26:39+00:00,"Dow Jones Futures Fall After Jobs Data; Key Economic Data, OPEC Meeting On Tap"
372,AAPL,2022-10-05T13:20:00+00:00,Better Buy: Alphabet vs. Apple
373,AAPL,2022-10-05T13:32:39+00:00,"Dow Jones Sells Off After Jobs Data; Key Economic Data, OPEC Meeting On Tap"
374,AAPL,2022-10-05T13:42:01+00:00,Warner Bros. Discovery's (WBD) HBO Max Reveals Halloween Lineup
375,AAPL,2022-10-05T13:52:06+00:00,Microsoft’s Turn Is Coming in Stock Battle of Titans
376,AAPL,2022-10-05T14:11:02+00:00,Amazon (AMZN) to Attract Customers With Fire TV Omni Series
377,AAPL,2022-10-05T14:15:00+00:00,Why I Wouldn't Touch Apple's Stock With a 10 Foot Pole
378,AAPL,2022-10-05T14:50:00+00:00,Former Apple Car Executive’s Battery Startup Plans $1.6 Billion Factory in Michigan
379,AAPL,2022-10-05T15:02:03+00:00,Amazon (AMZN) Boosts Its Healthcare Efforts With Halo Rise
380,AAPL,2022-10-05T15:11:38+00:00,SoftBank Proposes Long-Term Collaboration With Samsung During Seoul Visit: Report
381,AAPL,2022-10-05T15:42:00+00:00,Lightning vs. USB-C: Is the Switch Worth It?
382,AAPL,2022-10-05T17:01:14+00:00,Meta vs. Google: The Better Advertising Platform for Investors
383,AAPL,2022-10-05T17:25:58+00:00,TTD Analyst Remains Bullish Citing Stronger Relative Revenue &amp; FCF Growth Estimates
384,AAPL,2022-10-05T18:31:09+00:00,Google’s Pixel phones and Pixel Watch are all about selling you software
385,AAPL,2022-10-05T20:08:38+00:00,Making Sense of the Latest Apple-iPhone News
386,AAPL,2022-10-05T20:21:19+00:00,This Is the Best Time to Buy These 7 Long-Term Warren Buffett Stocks
387,AAPL,2022-10-05T21:45:09+00:00,Apple (AAPL) Gains As Market Dips: What You Should Know
388,AAPL,2022-10-05T23:00:00+00:00,Secretive Chip Startup May Help Huawei Circumvent US Sanctions
389,AAPL,2022-10-06T04:00:00+00:00,"iPhone 14 Plus Review: Bigger, Lighter, and Just as Fast"
390,AAPL,2022-10-06T04:01:00+00:00,"iPhone 14 Plus Review: Big Screen, Big Battery, Not-as-Big Price"
391,AAPL,2022-10-06T09:00:17+00:00,Animoca Charts Path from Gaming Studio to Crypto VC
392,AAPL,2022-10-06T09:14:00+00:00,1 Monster Opportunity in the Global Chip Shortage
393,AAPL,2022-10-06T09:37:00+00:00,"2 No-Brainer Dividend Stocks to Invest $1,000 in Right Now"
394,AAPL,2022-10-06T09:50:00+00:00,1 Tech Stock to Avoid Like the Plague Right Now
395,AAPL,2022-10-06T10:09:00+00:00,AT&amp;T CEO Sees His Satellite Phone Service Way Ahead Of Its Popular Peers
396,AAPL,2022-10-06T10:38:14+00:00,Walmart Strategically Times Its Holiday Sales Event To Win More Shoppers From Amazon
397,AAPL,2022-10-06T11:00:34+00:00,Will Satellite-To-Smartphone Services Get Lost In Space This Time?
398,AAPL,2022-10-06T13:06:33+00:00,Dow Jones Futures Fall As Jobless Claims Rise; Pivotal Jobs Report On Deck
399,AAPL,2022-10-06T14:00:11+00:00,Podcasts Spur Listeners to Swamp Health Workers With Angry Calls
400,AAPL,2022-10-06T14:06:00+00:00,New ETFs Offer Investors a Chance to Bet on the Metaverse
401,AAPL,2022-10-06T14:11:33+00:00,Dow Jones Slides As Jobless Claims Rise; Pivotal Jobs Report On Deck
402,AAPL,2022-10-06T14:45:24+00:00,"Google unveils Pixel Watch, starts at $349"
403,AAPL,2022-10-06T14:45:43+00:00,Google debuts Pixel 7 and Pixel 7 Pro with big camera changes
404,AAPL,2022-10-06T14:47:30+00:00,"Google's new Pixel Watch faces hurdles with economy, no iPhone support"
405,AAPL,2022-10-06T15:08:08+00:00,"Google's new Pixel Watch faces hurdles with economy, no iPhone support"
406,AAPL,2022-10-06T15:08:08+00:00,"Google's new Pixel Watch faces hurdles with economy, no iPhone support"
407,AAPL,2022-10-06T15:14:22+00:00,What Top Warren Buffett Holding Apple Stock Could Do For Crypto
408,AAPL,2022-10-06T15:30:38+00:00,This Major Apple Competitor Braced To Relaunch 5G Smartphones Amid Odds
409,AAPL,2022-10-06T15:45:19+00:00,Google Unveils New Phones and Watch That Undercut Apple on Price
410,AAPL,2022-10-06T15:59:18+00:00,France Slashes Apple's Antitrust Penalty By 66%: Report
411,AAPL,2022-10-06T16:25:34+00:00,Stock Market Today: Dow Slips Ahead of Jobs Data as Fed Speakers See More Hikes
412,AAPL,2022-10-06T16:49:49+00:00,Best FANG Stock ETFs for Q4 2022
413,AAPL,2022-10-06T17:00:00+00:00,"Apple iPhone 14 Wait Times Improving in All Geographies, Analyst Says"
414,AAPL,2022-10-06T17:50:33+00:00,Commerce Department Defends Its Ethics After Senator Warren Slams Tech Ties
415,AAPL,2022-10-06T19:39:43+00:00,Why Spotify Stock Was Down 20% Last Month
416,AAPL,2022-10-06T19:43:20+00:00,This Is the Best Time to Buy These 7 Long-Term Metaverse Stocks
417,AAPL,2022-10-06T22:22:21+00:00,Google Contractors Allege They Were Fired for Union Ties
418,AAPL,2022-10-06T23:44:30+00:00,"In Apple's shadow, Google takes new route to face recognition on Pixel phones"
419,AAPL,2022-10-07T05:41:12+00:00,TSMC Sales Top Estimates as Clout Helps Chip Giant During Slowdown
420,AAPL,2022-10-07T09:21:00+00:00,These 2 Stocks Make Up 52% of Warren Buffett's $325 Billion Portfolio
421,AAPL,2022-10-07T10:01:48+00:00,Key Apple Supplier Clocks 48% Sales Growth In Q3
422,AAPL,2022-10-07T11:00:00+00:00,These 3 Tech Stocks Are Building the Future
423,AAPL,2022-10-07T11:15:17+00:00,Taiwan Tensions Spark New Round of US War-Gaming on Risk to TSMC
424,AAPL,2022-10-07T12:00:33+00:00,Top 10 Stock Picks of Frederick DiSanto’s Ancora Advisors
425,AAPL,2022-10-07T12:32:16+00:00,7 Robinhood Stocks That Are Too Cheap to Ignore
426,AAPL,2022-10-07T13:24:03+00:00,11 Best FAANG Stocks To Buy Now
427,AAPL,2022-10-07T14:00:37+00:00,The Best Mutual Funds Invest Huge Sums In These 24 Stocks
428,AAPL,2022-10-07T14:03:02+00:00,Alphabet (GOOGL) Expands Pixel Family With Latest Devices
429,AAPL,2022-10-07T14:50:00+00:00,Facebook Warns Users About 400 Malicious Apps That Steal Passwords
430,AAPL,2022-10-07T15:15:58+00:00,S&amp;P 500 Slips as Strong Jobs Report Puts Hawkish Fed Bets Back in Focus
431,AAPL,2022-10-07T16:11:58+00:00,Stock Market Today: Dow Stumbles as Strong Jobs Data Strike Down 'Fed Pivot' Hopes
432,AAPL,2022-10-07T18:09:21+00:00,"AppLovin Analyst Fears Competition From Meta, Google, Apple"
433,AAPL,2022-10-07T18:17:01+00:00,Biden Tightens China Chip Rules on Chaotic Day for Industry
434,AAPL,2022-10-07T18:36:54+00:00,One million Facebook users warned their login details may have been stolen
435,AAPL,2022-10-07T19:32:05+00:00,"This Most 'Attractive' Media Acquisition Target Worth 'Well Above' MGM's $8.5B Sale To Amazon In A Deal, Analysts Speculate"
436,AAPL,2022-10-07T20:05:00+00:00,2 Unstoppable Warren Buffett Stocks That Can Turn Sitting Cash Into Growing Wealth
437,AAPL,2022-10-07T21:00:47+00:00,"Dow Jones Dives, Market Rally Attempt Reeling As AMD, Tesla, On Semi Plunge; What To Do Now"
438,AAPL,2022-10-07T22:38:18+00:00,3 Under-$10 Stocks to Buy to Tap Into a Hidden Bull Market
439,AAPL,2022-10-07T22:45:00+00:00,Weekly Roundup
440,AAPL,2022-10-07T23:16:47+00:00,"Dow Jones Dives Toward Bear Market Lows As AMD, Tesla, On Semi Plunge; What To Do Now"
441,AAPL,2022-10-08T10:45:00+00:00,3 Hidden-Gem Growth Stocks to Buy in October
442,AAPL,2022-10-08T10:49:00+00:00,"Got $1,000? 5 Buffett Stocks to Buy and Hold Forever."
443,AAPL,2022-10-08T11:05:00+00:00,This Top Tech Stock Is Now Yielding a 3.5% a Year Dividend
444,AAPL,2022-10-08T11:13:00+00:00,"Apple's CEO Bashes the Metaverse, and Nvidia's CEO Embraces It: What It Means for Investors"
445,AAPL,2022-10-08T12:00:00+00:00,A Look at Market News and an Interview With Author Scott Galloway
446,AAPL,2022-10-08T13:00:00+00:00,Here Are the Few Stock-Fund Managers Who Managed to Post Gains Over the Past Year
447,AAPL,2022-10-08T22:24:47+00:00,"Dow Jones Futures: Flailing Rally Near Bear Market Lows As AMD, Tesla Plunge; What To Do"
448,AAPL,2022-10-08T23:45:47+00:00,"Dow Jones Futures: Will Stocks Break Bear Market Lows? AMD, Tesla Plunge"
449,AAPL,2022-10-09T01:39:47+00:00,"Dow Jones Futures: Stocks Threaten Bear Market Lows; AMD, Tesla Plunge"
450,AAPL,2022-10-09T11:00:46+00:00,Here's Why Apple (NASDAQ:AAPL) Has Caught The Eye Of Investors
451,AAPL,2022-10-09T12:42:00+00:00,Here's How Meta Platforms Plans to Disrupt Apple's and Google's Smartphone Empires
452,AAPL,2022-10-09T13:00:00+00:00,‘The Owner of This iPhone Was in a Severe Car Crash’—or Just on a Roller Coaster
453,AAPL,2022-10-09T14:15:00+00:00,3 Companies That Could Be Worth $1 Trillion by 2030
454,AAPL,2022-10-09T18:27:47+00:00,Dow Jones Futures Due With Stocks Back Near Bear Market Lows; What To Do Now
455,AAPL,2022-10-09T18:52:47+00:00,Dow Jones Futures Loom With Stocks Back Near Bear Market Lows; What To Do Now
456,AAPL,2022-10-09T19:37:32+00:00,11 Best Motley Fool Stocks To Buy Now
457,AAPL,2022-10-09T19:52:47+00:00,Dow Jones Futures Loom: What Will Ailing Market Rally Discover On Columbus Day?
458,AAPL,2022-10-09T22:53:47+00:00,Dow Jones Futures Fall: What Will Ailing Market Rally Discover On Columbus Day?
459,AAPL,2022-10-09T23:36:42+00:00,"Stocks Face Brutal Earnings Season With All Eyes on Apple, Investors Say"
460,AAPL,2022-10-10T10:00:15+00:00,7 Warren Buffett Stocks to Buy to Ride Out This Bear Market
461,AAPL,2022-10-10T10:12:47+00:00,Dow Jones Futures: What Will Ailing Market Rally Discover On Columbus Day?
462,AAPL,2022-10-10T10:19:57+00:00,Tech Earnings Matter More Than Ever as the Bubble Deflates
463,AAPL,2022-10-10T10:30:32+00:00,This Is the Best Time to Buy These 7 Long-Term Blue-Chip Stocks
464,AAPL,2022-10-10T11:53:00+00:00,Apple Stock Edges Higher As IDC Report Shows Solid Q3 Mac Shipments
465,AAPL,2022-10-10T12:20:35+00:00,Dow Jones Futures Waver Ahead Of Q3 Earnings Season; Tesla Hits Record China Deliveries
466,AAPL,2022-10-10T12:30:00+00:00,3 Stocks to Avoid This Week
467,AAPL,2022-10-10T12:30:14+00:00,iPhones call police after mistaking rollercoaster rides for car crashes
468,AAPL,2022-10-10T12:38:35+00:00,Dow Jones Futures Rise Ahead Of Q3 Earnings Season; Tesla Hits Record China Deliveries
469,AAPL,2022-10-10T13:20:59+00:00,"More Export Control Restrictions On Semiconductors To China, Alibaba and Other Chinese Stocks Fall"
470,AAPL,2022-10-10T13:29:12+00:00,12 Best Stocks for Long-Term Growth
471,AAPL,2022-10-10T13:34:21+00:00,The Motley Fool’s 1623 Capital Latest Portfolio: Top 10 Stock Picks
472,AAPL,2022-10-10T13:34:35+00:00,Dow Jones Rises Ahead Of Earnings Season; Tesla Hits Record China Deliveries
473,AAPL,2022-10-10T14:10:35+00:00,Dow Jones Reverses Ahead Of Earnings Season; Tesla Hits Record China Deliveries
474,AAPL,2022-10-10T14:18:30+00:00,S&amp;P 500 Slips as Rout in Chips Weighs
475,AAPL,2022-10-10T14:33:49+00:00,"Amazon, Tesla, Apple stocks moving in early trading"
476,AAPL,2022-10-10T14:45:00+00:00,Amazon Is Taking $50 off the Apple Watch Series 8
477,AAPL,2022-10-10T15:24:21+00:00,Rollercoasters trigger crash detection on Apple iPhones
478,AAPL,2022-10-10T15:30:00+00:00,Best Stock to Buy: Nvidia vs. Apple
479,AAPL,2022-10-10T15:36:07+00:00,"IDC Highlights Weak PC Market, Apple Being The Only Exception"
480,AAPL,2022-10-10T16:03:13+00:00,Stock Market Today: Dow Slips as Chips Dip to Spark Tech Rout
481,AAPL,2022-10-10T17:48:02+00:00,Apple Stock Weighed Down By These Investor Worries
482,AAPL,2022-10-10T18:08:00+00:00,PC sales log third straight quarter of declines while Apple reports growth
483,AAPL,2022-10-10T18:09:02+00:00,"Dow Jones Reverses Sharply; Apple Mac Sales Surge 40%, Buck PC Downtrend"
484,AAPL,2022-10-10T18:09:02+00:00,Dow Jones Breaks Even; Chip Stocks Hit New Lows; Apple Mac Sales Buck Downtrend
485,AAPL,2022-10-10T18:16:00+00:00,"Apple’s iPad Sales Could Fall This Year and Next, Analyst Says"
486,AAPL,2022-10-10T18:18:00+00:00,Prologis Passes American Tower Corp In Size By Market Cap - Becomes The Highest Valued REIT
487,AAPL,2022-10-10T21:27:00+00:00,"PC market in ‘steepest’ fall since data started being collected in mid-1990s, analysts agree"
488,AAPL,2022-10-11T03:42:38+00:00,"Some Apple workers in Australia vote to strike over pay, benefits"
489,AAPL,2022-10-11T08:30:23+00:00,"India to press Apple, Samsung for faster 5G software upgrades in phones"
490,AAPL,2022-10-11T09:05:18+00:00,"UPDATE 1-India to press Apple, Samsung for faster 5G software upgrades in phones"
491,AAPL,2022-10-11T09:57:00+00:00,Got $100? Buy These 2 Beaten-Down Stocks Before They Go on a Bull Run
492,AAPL,2022-10-11T10:21:00+00:00,Apple's M1 MacBook Air Just Hit $799 on Amazon
493,AAPL,2022-10-11T12:00:00+00:00,The Non-Apple PC Market Has Fallen Below Pre-Pandemic Levels
494,AAPL,2022-10-11T12:09:55+00:00,"India To Urge Apple, Samsung For Faster 5G Upgrades"
495,AAPL,2022-10-11T12:15:00+00:00,3 Tech Stocks With More Potential Than Any Cryptocurrency
496,AAPL,2022-10-11T12:33:00+00:00,MarketWatch Moments: How Lehman and the iPhone reshaped financial markets
497,AAPL,2022-10-11T12:36:39+00:00,Dow Jones Futures Reverse As Nasdaq Hits 2-Year Low; 10-Year Treasury Yield Nears 4%
498,AAPL,2022-10-11T13:00:01+00:00,Apple Inc. (AAPL) is Attracting Investor Attention: Here is What You Should Know
499,AAPL,2022-10-11T13:03:00+00:00,"Apple’s iPhone Revenue Will Top Consensus on Demand for Pricier Models, Analyst Says"
500,AAPL,2022-10-11T13:32:39+00:00,Dow Jones Falls As 10-Year Treasury Yield Nears 4%
501,AAPL,2022-10-11T13:33:00+00:00,1 Big Reason Microsoft's Vision For Mixed Reality Failed
502,AAPL,2022-10-11T14:07:39+00:00,"Dow Jones Falls, Tech Stocks Dive As 10-Year Treasury Yield Nears 4%"
503,AAPL,2022-10-11T14:45:00+00:00,How Can You Afford Not to Be Invested in Apple?
504,AAPL,2022-10-11T15:21:44+00:00,10 Best Indian Stocks to Buy in USA
505,AAPL,2022-10-11T16:57:00+00:00,Apple's New AirPods Pro at the Lowest Price We've Seen on Amazon
506,AAPL,2022-10-11T17:15:00+00:00,Meta Shares Drop to Lowest Level in 4 Years After Downgrade
507,AAPL,2022-10-11T17:59:00+00:00,"Meta’s new VR headset will cost $1,500 as Zuckerberg sets up battle with Apple"
508,AAPL,2022-10-11T18:47:01+00:00,AMC Stock: Perhaps the Apes WERE Right about AMC Entertainment After All
509,AAPL,2022-10-11T21:12:00+00:00,How Micron Sidestepped the Tech Wreck on Tuesday and Gained 4.5%
510,AAPL,2022-10-11T21:45:09+00:00,Apple (AAPL) Dips More Than Broader Markets: What You Should Know
511,AAPL,2022-10-11T23:01:49+00:00,India looks to move up tech value chain with iPhone plant deal
512,AAPL,2022-10-12T00:12:16+00:00,Chip Firm Socionext to Debut in Tokyo After Japan’s Biggest 2022 IPO
513,AAPL,2022-10-12T06:55:01+00:00,Apple to roll out 5G in India in Dec amid early adoption push
514,AAPL,2022-10-12T06:56:56+00:00,Apple to roll out 5G in India in Dec amid early adoption push
